created_at,updated_at,page,url,job_id,status_code,parser_type,content.url,content.page,content.results.main,content.results.additional,content.results.total_results_count,content.parse_status_code
2024-05-24 03:08:18,2024-05-24 03:08:25,7,https://www.google.com/search?q=nvidia+stock&tbm=nws&uule=w+CAIQICIFaW5kaWE&gl=in&hl=en&start=60,7199607116460479489,200,,https://www.google.com/search?q=nvidia+stock&tbm=nws&uule=w+CAIQICIFaW5kaWE&gl=in&hl=en&start=60,7,"[{'url': 'https://fortune.com/2024/05/22/nvidia-earnings-stock-split-jensen-huang-blackwell-ai/', 'desc': ""Markets breathed a sigh of relief after Nvidia's long-anticipated earnings \nreport comfortably beat expectations, with revenue up an..."", 'title': ""Nvidia announces threefold sales increase in another blowout earnings \nreport—'We're racing every day,' says CEO ..."", 'source': 'Fortune', 'pos_overall': 1, 'relative_publish_date': '1 day ago'}, {'url': 'https://www.ft.com/content/2ce59a81-61b7-4052-810e-8bdc425367e4', 'desc': 'Semiconductor maker also announces a 10-for-1 stock split after quarterly \nresults beat high expectations.', 'title': ""Nvidia's revenue soars 262% on record AI chip demand"", 'source': 'Financial Times', 'pos_overall': 2, 'relative_publish_date': '13 hours ago'}, {'url': 'https://www.wsj.com/livecoverage/stock-market-today-dow-jones-earnings-05-22-2024', 'desc': 'The S&P 500 and Nasdaq Composite retreated from their record highs.', 'title': 'Stock Market News, May 22, 2024: Nvidia Shares Rise After Earnings Top \nExpectations', 'source': 'WSJ', 'pos_overall': 3, 'relative_publish_date': '17 hours ago'}, {'url': 'https://www.ft.com/content/20697f42-83fa-423e-8678-dc1b4191a2fe', 'desc': 'Nvidia surpasses $2.5tn market cap on another set of blockbuster earnings.', 'title': 'US stocks sink as robust economic data offsets Nvidia cheer', 'source': 'Financial Times', 'pos_overall': 4, 'relative_publish_date': '7 hours ago'}, {'url': 'https://www.wsj.com/tech/nvidia-nvda-q1-earnings-report-2025-94306f1f', 'desc': ""CEO Jensen Huang gives better-than-expected outlook, saying demand remains \nstrong for the company's chips."", 'title': ""Nvidia's Sales Triple, Signaling AI Boom's Staying Power"", 'source': 'WSJ', 'pos_overall': 5, 'relative_publish_date': '17 hours ago'}, {'url': 'https://www.livemint.com/market/stock-market-news/indian-stock-market-5-key-things-that-changed-for-market-overnight-gift-nifty-to-nvidia-results-us-fed-meet-minutes-11716395643735.html', 'desc': 'Indian stock market: Gift Nifty today morning is trading flat to positive \nas Gift Nifty saw morning trade at 22671, up 21 points.', 'title': 'Indian stock market: 5 key things that changed for market overnight - Gift \nNifty to Nvidia results, US Fed meet minutes | Stock Market News', 'source': 'mint', 'pos_overall': 6, 'relative_publish_date': '1 day ago'}, {'url': 'https://www.cnbctv18.com/market/nvidia-q1-results-what-to-expect-from-ai-heavyweight-stock-chipmaker-earnings-19415878.htm', 'desc': 'Analysts predict earnings of $13.2 billion, equating to $5.62 per share, \nwith projected quarterly revenue of $24.6 billion.', 'title': ""What to expect from AI-heavyweight Nvidia's Q1 earnings"", 'source': 'cnbctv18', 'pos_overall': 7, 'relative_publish_date': '1 day ago'}, {'url': 'https://finance.yahoo.com/video/nvidia-stock-split-wont-change-140125043.html', 'desc': 'Nvidia (NVDA) issued its first quarter results on Wednesday afternoon, \nbeating Wall Street expectations and announcing a 10-for-1 stock...', 'title': ""Nvidia stock split won't change much, but still a buy: Analyst"", 'source': 'Yahoo Finance', 'pos_overall': 8, 'relative_publish_date': '13 hours ago'}, {'url': 'https://www.wsj.com/livecoverage/stock-market-today-dow-jones-earnings-05-22-2024/card/nvidia-earnings-what-to-watch-gT9ocnHyJbZTrkoCqgGx', 'desc': ""Nvidia shares rose in late trading after the company's latest quarterly \nresults beat analysts' expectations for sales and net income."", 'title': 'Nvidia Stock Rises After Earnings Beat Estimates, Company Announces \n10-for-1 Split', 'source': 'WSJ', 'pos_overall': 9, 'relative_publish_date': '1 day ago'}, {'url': 'https://www.investors.com/etfs-and-funds/sectors/sp500-how-much-10000-invested-in-nvidia-10-years-ago-is-worth-now/', 'desc': 'Shares of AI champion Nvidia keep racing higher. And now the money made on \nthe S&P 500 stock is at breathtaking levels.', 'title': 'How Much $10000 Invested In Nvidia 10 Years Ago Is Worth Now', 'source': ""Investor's Business Daily"", 'pos_overall': 10, 'relative_publish_date': '7 hours ago'}]",,7,12000
2024-05-24 03:08:18,2024-05-24 03:08:27,8,https://www.google.com/search?q=nvidia+stock&tbm=nws&uule=w+CAIQICIFaW5kaWE&gl=in&hl=en&start=70,7199607116460479489,200,,https://www.google.com/search?q=nvidia+stock&tbm=nws&uule=w+CAIQICIFaW5kaWE&gl=in&hl=en&start=70,8,"[{'url': 'https://www.investors.com/etfs-and-funds/sectors/sp500-how-much-10000-invested-in-nvidia-10-years-ago-is-worth-now/', 'desc': 'Shares of AI champion Nvidia keep racing higher. And now the money made on \nthe S&P 500 stock is at breathtaking levels.', 'title': 'How Much $10000 Invested In Nvidia 10 Years Ago Is Worth Now', 'source': ""Investor's Business Daily"", 'pos_overall': 1, 'relative_publish_date': '7 hours ago'}, {'url': 'https://www.cnbc.com/2024/05/22/nvidia-nvda-earnings-report-q1-2025-.html', 'desc': 'Nvidia reported fiscal first-quarter earnings on Wednesday that beat \nexpectations for sales and earnings, and the stock rose in extended...', 'title': 'Nvidia shares pass $1,000 for first time on AI-driven sales surge', 'source': 'CNBC', 'pos_overall': 2, 'relative_publish_date': '1 day ago'}, {'url': 'https://www.fool.com/investing/2024/05/23/nvidia-deliver-round-record-profit-ai-stock/', 'desc': ""Coming into Nvidia's (NVDA 9.32%) fiscal 2025 first-quarter earnings \nreport, expectations were sky-high. Nvidia stock has been the..."", 'title': 'Nvidia Did It Again. Is the AI Stock a Buy After Another Round of Record \nProfits?', 'source': 'The Motley Fool', 'pos_overall': 3, 'relative_publish_date': '14 hours ago'}, {'url': 'https://www.hindustantimes.com/business/jensen-huang-says-revolution-here-as-nvidia-ignites-140-billion-stock-rally-heres-why-101716429251589.html', 'desc': ""Nvidia CEO Jensen Huang said that this is the dawning of a new era as his \ncompany's market valuation skyrocketed, topping $2.3 trillion."", 'title': ""Jensen Huang says ‘revolution here' as Nvidia ignites $140 billion stock \nrally. Here's why"", 'source': 'Hindustan Times', 'pos_overall': 4, 'relative_publish_date': '1 day ago'}, {'url': 'https://www.cnbc.com/2024/05/23/investing-alternatives-to-chasing-nvidias-stock-using-options-after-its-blockbuster-report.html', 'desc': 'Mike Khouw reviews a margin of safety trade on Nvidia.', 'title': ""Investing alternatives to chasing Nvidia's stock using options after its \nblockbuster report"", 'source': 'CNBC', 'pos_overall': 5, 'relative_publish_date': '11 hours ago'}, {'url': 'https://www.investors.com/market-trend/stock-market-today/dow-jones-sp500-nasdaq-nvidia-nvda-stock-elf/', 'desc': 'The Dow Jones sank as Nasdaq reversed lower on Thursday. Nvidia stock was \nthe biggest gainer on the S&P 500 in the stock market today.', 'title': 'Dow Loses More Than 600 Points; Nvidia Outshines In The Stock Market Today', 'source': ""Investor's Business Daily"", 'pos_overall': 6, 'relative_publish_date': '7 hours ago'}, {'url': 'https://www.investopedia.com/investors-expect-the-best-from-nvidia-earnings-what-that-could-mean-for-the-stock-8651022', 'desc': ""Nvidia shares rose Monday ahead of the company's high-stakes first-quarter \nearnings report, which will come after markets close on Wednesday..."", 'title': 'Investors Expect the Best From Nvidia Earnings—What That Could Mean for the \nStock', 'source': 'Investopedia', 'pos_overall': 7, 'relative_publish_date': '3 days ago'}, {'url': 'https://www.usatoday.com/story/money/investing/2024/05/22/nvidia-stock-split-earnings-report/73808415007/', 'desc': 'Graphics and artificial intelligence company Nvidia announced a 10-for-one \nstock split as a part of its first quarter earnings release...', 'title': ""Nvidia announces 10-to-1 stock split: Here's everything to know"", 'source': 'USA Today', 'pos_overall': 8, 'relative_publish_date': '1 day ago'}, {'url': 'https://www.cnbc.com/2024/05/22/the-key-levels-to-watch-on-nvidias-stock-chart-with-its-big-earnings-report-almost-here.html', 'desc': 'Frank Cappelleri gives a full breakdown of Nvidia results ahead of the big \nearnings.', 'title': ""The key levels to watch on Nvidia's stock chart with its big earnings \nreport almost here"", 'source': 'CNBC', 'pos_overall': 9, 'relative_publish_date': '1 day ago'}, {'url': 'https://investorplace.com/2024/05/nvidia-stock-split-alert-what-a-10-for-1-nvda-split-means-for-you/', 'desc': ""An Nvidia stock split is scheduled for the first week of June, 2024. Here's \nwhy this is good news for investors and for NVDA stock."", 'title': 'Nvidia Stock Split Alert: What a 10-for-1 NVDA Split Means for You', 'source': 'InvestorPlace', 'pos_overall': 10, 'relative_publish_date': '12 hours ago'}]",,8,12000
2024-05-24 03:08:18,2024-05-24 03:08:28,9,https://www.google.com/search?q=nvidia+stock&tbm=nws&uule=w+CAIQICIFaW5kaWE&gl=in&hl=en&start=80,7199607116460479489,200,,https://www.google.com/search?q=nvidia+stock&tbm=nws&uule=w+CAIQICIFaW5kaWE&gl=in&hl=en&start=80,9,"[{'url': 'https://www.foxbusiness.com/markets/nvidia-shares-stock-split', 'desc': 'Nvidia is cashing in on the AI boom it has been driving by giving investors \na hefty 10-for-1 stock split as revenues continue to grow faster...', 'title': 'Nvidia announces 10-for-1 stock split, shares hit $1,000', 'source': 'Fox Business', 'pos_overall': 1, 'relative_publish_date': '14 hours ago'}, {'url': 'https://www.cnbc.com/2024/05/22/stock-market-today-live-updates.html', 'desc': 'Stocks declined Thursday as Wall Street assessed the latest quarterly \nresults from market bellwether Nvidia.', 'title': ""Dow falls 600 points in worst day of 2024 as Nvidia's blockbuster earnings \nfail to lift broader market: Live updates"", 'source': 'CNBC', 'pos_overall': 2, 'relative_publish_date': '7 hours ago'}, {'url': 'https://www.nasdaq.com/articles/stocks-fall-despite-nvidias-impressive-quarter', 'desc': 'The S&P 500 Index ($SPX ) (SPY ) today is down -0.70%, the Dow Jones \nIndustrials Index ($DOWI ) (DIA ) is down -1.53%, and the Nasdaq 100...', 'title': ""Stocks Fall Despite Nvidia's Impressive Quarter"", 'source': 'Nasdaq', 'pos_overall': 3, 'relative_publish_date': '9 hours ago'}, {'url': 'https://finance.yahoo.com/video/stocks-close-lower-dow-falls-201419915.html', 'desc': ""Stocks (^DJI, ^IXIC, ^GSPC) have reversed at Thursday's market close, \ninitially riding high off of Nvidia's (NVDA) fiscal first-quarter..."", 'title': 'Stocks close lower, Dow falls by 600 despite Nvidia earnings', 'source': 'Yahoo Finance', 'pos_overall': 4, 'relative_publish_date': '7 hours ago'}, {'url': 'https://www.investors.com/news/tesla-stock-nvidia-stock-jensen-huang/', 'desc': ""Tesla stock rose after Nvidia CEO Jensen Huang talked up Tesla's autonomous \ndriving efforts as his company eyes the auto industry's AI..."", 'title': ""Nvidia Chief Touts Auto Industry's AI Demand, Says Tesla 'Far Ahead'"", 'source': ""Investor's Business Daily"", 'pos_overall': 5, 'relative_publish_date': '7 hours ago'}, {'url': 'https://www.fool.com/investing/2024/05/20/stock-split-watch-is-nvidia-next/', 'desc': 'With its share price around $950, Nvidia could be a candidate for another \nstock split.', 'title': 'Stock Split Watch: Is Nvidia Next?', 'source': 'The Motley Fool', 'pos_overall': 6, 'relative_publish_date': '3 days ago'}, {'url': 'https://finance.yahoo.com/news/why-intel-stock-sliding-today-193224292.html', 'desc': 'A strong report from Nvidia seemed to be bad news for Intel.', 'title': 'Why Intel Stock Was Sliding Today', 'source': 'Yahoo Finance', 'pos_overall': 7, 'relative_publish_date': '8 hours ago'}, {'url': 'https://finance.yahoo.com/video/arista-networks-stock-pressured-nvidias-194142862.html', 'desc': 'Arista Networks (ANET) shares tumble after chip giant Nvidia (NVDA) blew \npast its fiscal first-quarter 2025 earnings expectations.', 'title': ""Arista Networks stock pressured by Nvidia's networking goals"", 'source': 'Yahoo Finance', 'pos_overall': 8, 'relative_publish_date': '7 hours ago'}, {'url': 'https://www.fool.com/investing/2024/05/23/10-shocking-points-nvidia-stock-investors-should-k/', 'desc': 'Nvidia is building a colossal cash position, but what will it do with it?', 'title': '10 Shocking Points Nvidia Stock Investors Should Know After Earnings', 'source': 'The Motley Fool', 'pos_overall': 9, 'relative_publish_date': '13 hours ago'}, {'url': 'https://finance.yahoo.com/video/nvidia-announces-stock-split-posts-210444345.html', 'desc': 'Nvidia (NVDA) made a lot of headlines while posting its fiscal 2025 first \nquarter results. The tech giant posted adjusted earnings per share...', 'title': 'Nvidia announces stock split, posts Q1 earnings beat', 'source': 'Yahoo Finance', 'pos_overall': 10, 'relative_publish_date': '1 day ago'}]",,9,12000
2024-05-24 03:08:18,2024-05-24 03:08:29,10,https://www.google.com/search?q=nvidia+stock&tbm=nws&uule=w+CAIQICIFaW5kaWE&gl=in&hl=en&start=90,7199607116460479489,200,,https://www.google.com/search?q=nvidia+stock&tbm=nws&uule=w+CAIQICIFaW5kaWE&gl=in&hl=en&start=90,10,"[{'url': 'https://www.reuters.com/markets/global-markets-wrapup-1-2024-05-23/', 'desc': ""U.S. stocks ended sharply lower on Thursday as enthusiasm over Nvidia's \nquarterly results faded and robust economic data fueled concerns..."", 'title': 'Wall Street tumbles as AI fervor dampened by rate jitters', 'source': 'Reuters', 'pos_overall': 1, 'relative_publish_date': '4 hours ago'}, {'url': 'https://qz.com/nvidia-earnings-q1-2024-1851494672', 'desc': ""The chipmaker's latest earnings smashed Wall Street expectations, and it \nalso announced a 10-to-1 stock split."", 'title': 'Nvidia teases a new chip as its stock clears $1000 for the first time', 'source': 'Quartz', 'pos_overall': 2, 'relative_publish_date': '1 day ago'}, {'url': 'https://www.investors.com/market-trend/stock-market-today/dow-jones-sp500-nasdaq-nvidia-earnings-nvda-stock/', 'desc': 'Stock Market Today: The Dow Jones dropped Thursday after jobless claims. \nNvidia stock surged above $1000 on strong earnings results.', 'title': 'Stock Market Today: Dow Jones Slides After Jobless Claims; Nvidia Surges On \nEarnings', 'source': ""Investor's Business Daily"", 'pos_overall': 3, 'relative_publish_date': '13 hours ago'}, {'url': 'https://www.fxstreet.com/news/nvidia-stock-earnings-preview-nvda-advances-ahead-of-wednesdays-q1-results-202405201532', 'desc': ""Nvidia (NVDA) is set to unveil its first-quarter fiscal 2025 results on \nWednesday after the close, and that's the main thing on the docket..."", 'title': 'Nvidia Stock Earnings Preview: NVDA advances ahead of Wednesday’s Q1 results', 'source': 'FXStreet', 'pos_overall': 4, 'relative_publish_date': '3 days ago'}, {'url': 'https://www.cnbc.com/2024/05/24/cio-shares-nvidia-alternative-ai-stocks-theres-another-way-to-play-this.html', 'desc': 'Nvidia is showing no signs of slowing down, but there are other ways to \nplay the AI trend, according to a CIO, who recommends ""old economy""...', 'title': ""CIO shares Nvidia alternatives to cash in on the AI theme: 'There's another \nway to play this'"", 'source': 'CNBC', 'pos_overall': 5, 'relative_publish_date': '3 hours ago'}, {'url': 'https://www.barrons.com/articles/nvidia-earnings-stock-ai-d1845d84', 'desc': ""The year-ago quarter was Nvidia's last flat sales period, before demand for \nits artificial intelligence chips ignited."", 'title': ""Nvidia Stock Powers to Record Highs. Why There's Still 'Gas in the Tank'."", 'source': ""Barron's"", 'pos_overall': 6, 'relative_publish_date': '13 hours ago'}, {'url': 'https://finance.yahoo.com/news/3-reasons-buy-nvidia-stock-110000403.html', 'desc': 'If you want to bet on generative artificial intelligence (AI), there is \nstill no better pick than Nvidia (NASDAQ: NVDA).', 'title': '3 Reasons to Buy Nvidia Stock Right Now (and 1 Reason to Sell)', 'source': 'Yahoo Finance', 'pos_overall': 7, 'relative_publish_date': '1 day ago'}, {'url': 'https://www.investors.com/market-trend/the-big-picture/stock-market-nvidia-earnings-nvda/', 'desc': 'The stock market reversed lower Thursday, even as Nvidia stock soared to \nall-time highs. Netflix is among the best stocks to watch.', 'title': 'Stock Market Reverses Lower Despite Hot Nvidia Earnings', 'source': ""Investor's Business Daily"", 'pos_overall': 8, 'relative_publish_date': '5 hours ago'}, {'url': 'https://www.marketwatch.com/story/nvidias-stock-surge-at-odds-with-the-s-p-500-to-a-degree-not-seen-in-8-years-c49022f8', 'desc': ""Nvidia has been a big driver of the market over the past year. But its \nmight wasn't enough on Thursday, as the chip stock saw big gains..."", 'title': 'Nvidia’s stock surge at odds with the S&P 500 — to a degree not seen in 8 \nyears', 'source': 'MarketWatch', 'pos_overall': 9, 'relative_publish_date': '6 hours ago'}, {'url': 'https://www.cnbc.com/2024/05/23/top-stocks-to-watch-on-wall-street-like-nvidia.html', 'desc': '2024 CNBC LLC. All Rights Reserved. A Division of NBCUniversal. Data is a \nreal-time snapshot *Data is delayed at least 15 minutes.', 'title': 'Top stocks to watch on Wall Street like Nvidia', 'source': 'CNBC', 'pos_overall': 10, 'relative_publish_date': '15 hours ago'}]",,10,12000
2024-05-24 03:08:18,2024-05-24 03:08:30,11,https://www.google.com/search?q=nvidia+stock&tbm=nws&uule=w+CAIQICIFaW5kaWE&gl=in&hl=en&start=100,7199607116460479489,200,,https://www.google.com/search?q=nvidia+stock&tbm=nws&uule=w+CAIQICIFaW5kaWE&gl=in&hl=en&start=100,11,"[{'url': 'https://www.wsj.com/livecoverage/stock-market-today-dow-jones-05-20-2024/card/traders-brace-for-another-dizzying-swing-in-nvidia-shares-NF8fVdgJZidwI5dFySLk', 'desc': 'Traders are betting on another mammoth move in Nvidia shares this week. \nPricing in the options market shows that traders are wagering on a...', 'title': 'Traders Brace for a Big Swing in Nvidia Stock After Earnings', 'source': 'WSJ', 'pos_overall': 1, 'relative_publish_date': '3 days ago'}, {'url': 'https://www.investors.com/research/magnificent-seven-stocks-to-buy-and-and-watch/', 'desc': ""Magnificent Seven stocks, including AI leader Nvidia, are among the best \nstocks to watch in today's stock market."", 'title': 'Magnificent Seven Stocks: Nvidia Stock Soars 10% On Earnings; Apple, Tesla \nSlide', 'source': ""Investor's Business Daily"", 'pos_overall': 2, 'relative_publish_date': '9 hours ago'}, {'url': 'https://www.marketwatch.com/livecoverage/nvidia-earnings-stock-ai-expectations-results-revenue-q1', 'desc': ""Nvidia reported fiscal first-quarter earnings on Wednesday, beating Wall \nStreet's expectations. MarketWatch broke down the results live."", 'title': ""Nvidia earnings: Stock gains as Nvidia's outlook impresses yet again"", 'source': 'MarketWatch', 'pos_overall': 3, 'relative_publish_date': '1 day ago'}, {'url': 'https://qz.com/nvidia-reports-earnings-what-expect-blackwell-ai-chips-1851485538', 'desc': ""Wall Street is expecting a strong showing from Nvidia's first quarter \nearnings, but some analysts are worried about a slowdown in demand for..."", 'title': ""Nvidia earnings are coming as the stock rises. Here's what to expect"", 'source': 'Quartz', 'pos_overall': 4, 'relative_publish_date': '2 days ago'}, {'url': 'https://www.marketwatch.com/story/nvidias-stock-is-a-bargain-provided-this-pattern-continues-20ddefa8', 'desc': ""Nvidia's stock is trading lower to expected profit than it did three years \nago, before its AI-related sales exploded."", 'title': 'Nvidia’s stock is a bargain — provided this pattern continues', 'source': 'MarketWatch', 'pos_overall': 5, 'relative_publish_date': '3 days ago'}, {'url': 'https://www.investors.com/market-trend/stock-market-today/dow-jones-futures-target-but-here-comes-nvidia/', 'desc': 'Dow Jones futures: The Nasdaq hit a new high Tuesday but Target tumbled \nearly Wednesday. Will Nvidia earnings tonight meet lofty hopes?', 'title': 'Dow Jones Futures Fall As Target Tumbles; Nvidia Looms Over Stock Market', 'source': ""Investor's Business Daily"", 'pos_overall': 6, 'relative_publish_date': '1 day ago'}, {'url': 'https://thespectator.com/topic/nvidia-stock-keep-rising/', 'desc': 'In the latest quarter alone Nvidia delivered revenues of $26 billion, well \nahead of the $24 billion that was forecast.', 'title': 'Can Nvidia stock keep rising?', 'source': 'The Spectator World', 'pos_overall': 7, 'relative_publish_date': '13 hours ago'}, {'url': 'https://finance.yahoo.com/video/why-analyst-says-nvidia-not-213435366.html', 'desc': 'The moment markets have been eagerly awaiting has finally arrived. Nvidia \n(NVDA) has released its first quarter earnings report,...', 'title': 'Why this analyst says Nvidia is not a stock to buy', 'source': 'Yahoo Finance', 'pos_overall': 8, 'relative_publish_date': '1 day ago'}, {'url': 'https://www.fool.com/investing/2024/05/22/nvidia-announces-a-10-for-1-stock-split-heres-what/', 'desc': 'This marks the largest stock split to date for the chipmaker.', 'title': ""Nvidia Announces a 10-for-1 Stock Split. Here's What Investors Need to Know."", 'source': 'The Motley Fool', 'pos_overall': 9, 'relative_publish_date': '1 day ago'}, {'url': 'https://www.investors.com/market-trend/stock-market-today/dow-jones-sp500-nasdaq-nvidia-stock-nvda-earnings/', 'desc': 'The Dow Jones fell Monday, as Nvidia stock rallied on the stock market \ntoday after a number of price-target hikes.', 'title': 'Stock Market Today: Dow Jones Falls As Nvidia Rallies On Price-Target Hikes', 'source': ""Investor's Business Daily"", 'pos_overall': 10, 'relative_publish_date': '3 days ago'}]",,11,12000
