created_at,updated_at,page,url,job_id,status_code,parser_type,content.url,content.page,content.results.main,content.results.additional,content.results.total_results_count,content.parse_status_code
2024-05-24 03:08:18,2024-05-24 03:08:20,1,https://www.google.com/search?q=nvidia+stock&tbm=nws&uule=w+CAIQICIFaW5kaWE&gl=in&hl=en,7199607116460479489,200,,https://www.google.com/search?q=nvidia+stock&tbm=nws&uule=w+CAIQICIFaW5kaWE&gl=in&hl=en,1,"[{'url': 'https://www.nytimes.com/2024/05/22/technology/nvidia-quarterly-earnings-results.html', 'desc': 'The Silicon Valley company was again lifted by sales of its artificial \nintelligence chips, but it faces growing competition and heightened...', 'title': 'Nvidia, Powered by A.I. Boom, Reports Soaring Revenue and Profits', 'source': 'The New York Times', 'pos_overall': 1, 'relative_publish_date': '1 day ago'}, {'url': 'https://m.economictimes.com/markets/expert-view/can-coforge-be-the-nvidia-of-india-which-largecap-can-give-mega-returns-for-next-2-3-years-sanjiv-bhasin-answers/articleshow/110353814.cms', 'desc': 'Sanjiv Bhasin of IIFL Securities advises caution in investing in defence \nand railway stocks due to unfavorable prices.', 'title': 'Can Coforge be the Nvidia of India? Which largecap can give mega returns \nfor next 2-3 years? Sanjiv Bhasin', 'source': 'The Economic Times', 'pos_overall': 2, 'relative_publish_date': '21 hours ago'}, {'url': 'https://www.investing.com/news/stock-market-news/us-stock-futures-rise-as-nvidia-cheer-offsets-fed-jitters-3453275', 'desc': 'Investing.com-- The S&P 500 closed lower Thursday, as rising Treasury \nyields on signs of sticky inflation dented rate-cut hopes offsetting...', 'title': ""Stock Market Today: S&P 500 snaps win streak as rising yields steal \nNvidia's shine"", 'source': 'Investing.com', 'pos_overall': 3, 'relative_publish_date': '1 day ago'}, {'url': 'https://pro.thestreet.com/market-commentary/nvidia-powers-ai-can-it-power-out-of-dullsville', 'desc': ""The stock market has been dull this past week. Will NVDA's earnings be \nenough to shake us out of the narrow range we're trapped in?"", 'title': 'Nvidia Powers AI. But Can It Power Us Out of Dullsville?', 'source': 'TheStreet Pro', 'pos_overall': 4, 'relative_publish_date': '17 hours ago'}, {'url': 'https://www.reuters.com/technology/nvidia-earnings-could-spark-200-billion-swing-shares-options-show-2024-05-21/', 'desc': ""Traders are pricing in a big move for Nvidia's shares after the chipmaker \nreports earnings on Wednesday, though expectations for volatility..."", 'title': 'Nvidia earnings could spark $200 billion swing in shares, options show', 'source': 'Reuters', 'pos_overall': 5, 'relative_publish_date': '1 day ago'}, {'url': 'https://www.euronews.com/business/2024/05/22/nvidia-shares-could-soar-as-traders-eye-first-quarter-earnings', 'desc': 'Nvidia is set to release its first-quarter earnings for the fiscal year \n2025. Investors will be particularly focused on the performance of...', 'title': 'Previewing Nvidia’s First-Quarter Earnings: What to expect?', 'source': 'Euronews', 'pos_overall': 6, 'relative_publish_date': '1 day ago'}]","[[], [], [], []]",12800,12000
2024-05-24 03:08:18,2024-05-24 03:08:21,2,https://www.google.com/search?q=nvidia+stock&tbm=nws&uule=w+CAIQICIFaW5kaWE&gl=in&hl=en&start=10,7199607116460479489,200,,https://www.google.com/search?q=nvidia+stock&tbm=nws&uule=w+CAIQICIFaW5kaWE&gl=in&hl=en&start=10,2,"[{'url': 'https://www.wsj.com/livecoverage/stock-market-today-dow-jones-earnings-05-23-2024/card/why-is-nvidia-splitting-its-stock-and-what-will-the-10-for-1-split-mean--eWfPUbLYiRzTtr7XWoiB', 'desc': ""Alongside another blockbuster earnings report, Nvidia said it planned to \nsplit its stock. Here's a look at what that means: Why is Nvidia..."", 'title': ""What Nvidia's 10-for-1 Stock Split Will Mean for Investors"", 'source': 'WSJ', 'pos_overall': 1, 'relative_publish_date': '4 hours ago'}, {'url': 'https://www.investopedia.com/nvidia-10-for-1-stock-split-is-coming-what-you-need-to-know-8652922', 'desc': 'Nvidia announced a 10-for-1 forward stock split along with its blockbuster \nearnings report Wednesday. Stock splits increase the number of...', 'title': ""Nvidia's 10-for-1 Stock Split Is Coming—What You Need To Know"", 'source': 'Investopedia', 'pos_overall': 2, 'relative_publish_date': '9 hours ago'}, {'url': 'https://www.investors.com/news/technology/nvidia-stock-breaks-out-on-q1-beat-and-raise-report/', 'desc': 'AI chip leader Nvidia topped even Wall Street\'s elevated ""whisper numbers"" \nwith its fiscal Q1 results and guidance. Nvidia stock rose.', 'title': 'Nvidia Stock Breaks Out On Jaw-Dropping Q1 Results, Outlook', 'source': ""Investor's Business Daily"", 'pos_overall': 3, 'relative_publish_date': '7 hours ago'}, {'url': 'https://finance.yahoo.com/news/ai-heavyweight-nvidia-forecasts-quarterly-202236454.html', 'desc': 'Shares of Nvidia surged over 9% on Thursday, building on a stunning rally \nas its bumper revenue forecast reinforced investor confidence in...', 'title': 'Nvidia adds over $200 billion in market value in post-earnings rally', 'source': 'Yahoo Finance', 'pos_overall': 4, 'relative_publish_date': '6 hours ago'}, {'url': 'https://www.businessinsider.com/nvidia-stock-price-split-earnings-ai-tech-microchips-investing-index-2024-5', 'desc': 'Nvidia announced a 10-for-1 stock split with the goal of making its $1000 \nshares more accessible to employees and investors.', 'title': 'Investing in Nvidia will get a whole lot cheaper after stock split', 'source': 'Business Insider', 'pos_overall': 5, 'relative_publish_date': '13 hours ago'}, {'url': 'https://www.reuters.com/markets/us/nvidias-split-soaring-stock-could-boost-retail-investor-appeal-dow-chances-2024-05-23/', 'desc': ""Nvidia's plan to split its stock after the stunning rise in the chipmaker's \nshare price could lure more interest from retail investors while..."", 'title': ""Nvidia's split of soaring stock could boost retail investor appeal, Dow \nchances"", 'source': 'Reuters', 'pos_overall': 6, 'relative_publish_date': '11 hours ago'}, {'url': 'https://www.moneycontrol.com/news/business/stocks/indian-mfs-set-to-gain-as-nvidia-crosses-1000-mark-on-yet-another-strong-quarter-12730437.html', 'desc': ""Nvidia is back in the news after the chipmaker's stocks crossed the \n$1,000-mark on May 23 for the first time, beating market expectations..."", 'title': 'Some Indian MFs set to gain as Nvidia crosses $1,000-mark on yet another \nstrong quarter', 'source': 'Moneycontrol', 'pos_overall': 7, 'relative_publish_date': '13 hours ago'}, {'url': 'https://www.investing.com/news/stock-market-news/nvidia-tops-1000-a-share-in-afterhours-trading-on-strong-outlook-stock-split-3452885', 'desc': ""Investing.com -- Shares in Nvidia (NASDAQ:NVDA) gained more than 9% in \nThursday trading after the semiconductor group's much-anticipated..."", 'title': 'Nvidia shares rise more than 9% following latest revenue surge', 'source': 'Investing.com', 'pos_overall': 8, 'relative_publish_date': '18 hours ago'}, {'url': 'https://www.fool.com/investing/2024/05/23/is-nvidia-stock-still-a-buy-after-it-just-popped-a/', 'desc': ""Nvidia's (NVDA 9.32%) latest earnings report was arguably the most highly \nanticipated of this earnings season."", 'title': 'Is Nvidia Stock Still a Buy After It Just Popped Again?', 'source': 'The Motley Fool', 'pos_overall': 9, 'relative_publish_date': '11 hours ago'}, {'url': 'https://www.cnbc.com/2024/05/23/what-nvidia-stock-split-means-for-investors.html', 'desc': 'Nvidia released its fiscal first-quarter earnings report on Wednesday, \nalong with news of a planned 10-for-1 stock split.', 'title': ""What Nvidia's 10-for-1 stock split means for investors—it's mostly \npsychological"", 'source': 'CNBC', 'pos_overall': 10, 'relative_publish_date': '10 hours ago'}]",,2,12000
2024-05-24 03:08:18,2024-05-24 03:08:22,3,https://www.google.com/search?q=nvidia+stock&tbm=nws&uule=w+CAIQICIFaW5kaWE&gl=in&hl=en&start=20,7199607116460479489,200,,https://www.google.com/search?q=nvidia+stock&tbm=nws&uule=w+CAIQICIFaW5kaWE&gl=in&hl=en&start=20,3,"[{'url': 'https://www.livemint.com/market/stock-market-news/wall-street-today-us-stocks-muted-ahead-of-nvidia-earnings-fed-minutes-11716386176562.html', 'desc': ""US stocks were drifting on Wednesday ahead of chip giant Nvidia's quarterly \nresults and the US Federal Reserve's policy meeting minutes."", 'title': 'Wall Street today: US stocks drift ahead of Fed minutes, Nvidia drops as \ninvestors await earnings | Stock Market News', 'source': 'mint', 'pos_overall': 1, 'relative_publish_date': '1 day ago'}, {'url': 'https://www.wsj.com/livecoverage/stock-market-today-dow-jones-earnings-05-23-2024', 'desc': 'All 30 Dow components fall for the first time this year.', 'title': 'Stock Market News, May 23, 2024: Indexes Close Lower, Nvidia Extends Climb', 'source': 'WSJ', 'pos_overall': 2, 'relative_publish_date': '4 hours ago'}, {'url': 'https://www.investopedia.com/where-is-nvidia-stock-price-headed-after-post-earnings-pop-8652786', 'desc': 'Nvidia shares jumped more than 6% in extended hours trading Wednesday \nevening after the AI darling delivered another blowout quarterly...', 'title': 'Where is Nvidia Stock Price Headed After Post-Earnings Pop?', 'source': 'Investopedia', 'pos_overall': 3, 'relative_publish_date': '1 day ago'}, {'url': 'https://markets.businessinsider.com/news/stocks/nvidia-stock-price-q1-earnings-10-for-1-stock-split-2024-5', 'desc': 'Nvidia announced a 10-for-1 stock split and increased its quarterly \ndividend by 150% from $0.04 to $0.10 per share.', 'title': 'Nvidia Stock Price Jumps After Big Earnings Beat, 10-for-1 Stock Split', 'source': 'markets.businessinsider.com', 'pos_overall': 4, 'relative_publish_date': '1 day ago'}, {'url': 'https://www.investors.com/market-trend/stock-market-today/dow-jones-futures-nvidia-soars-deckers-jumps-late/', 'desc': 'Dow Jones futures: The stock market rally had an ugly session, despite \nNvidia surging on earnings. Deckers spiked late, signaling a...', 'title': 'Dow Jones Futures: Nvidia Soars But Stock Market Has Ugly Day; Deckers \nJumps Late', 'source': ""Investor's Business Daily"", 'pos_overall': 5, 'relative_publish_date': '26 minutes ago'}, {'url': 'https://www.investors.com/research/stock-screener-stocks-to-buy-watch/', 'desc': 'Featuring Nvidia, Cava, Chipotle and more, this stock screener highlights \ntop-rated stocks to watch right now.', 'title': 'Stock Screener: Nvidia Leads List Of Stocks To Watch', 'source': ""Investor's Business Daily"", 'pos_overall': 6, 'relative_publish_date': '7 hours ago'}, {'url': 'https://www.livemint.com/companies/company-results/nvidias-profit-jumps-amid-dominance-in-chip-for-ai-key-highlights-11716425733893.html', 'desc': 'Nvidia experienced a remarkable increase in profits and revenues, rising by \n628% and 268% respectively, compared to the corresponding period...', 'title': 'Nvidia profit soars over 600%, shares top $1,000: From 10:1 stock split to \ndividend – key highlights from results | Company Business News', 'source': 'mint', 'pos_overall': 7, 'relative_publish_date': '1 day ago'}, {'url': 'https://www.cnbc.com/2024/05/23/nvidia-keeps-hitting-records-can-investors-still-buy-the-stock.html', 'desc': ""Shares of Nvidia surged to record highs Thursday, following the artificial \nintelligence chip giant's after-the-bell quarterly results that..."", 'title': 'Nvidia stock keeps hitting records. Can investors with little to no shares \nstill buy?', 'source': 'CNBC', 'pos_overall': 8, 'relative_publish_date': '7 hours ago'}, {'url': 'https://www.reuters.com/technology/ai-heavyweight-nvidia-forecasts-quarterly-revenue-above-estimates-2024-05-22/', 'desc': 'Nvidia forecast quarterly revenue above estimates on Wednesday and \nannounced a stock split, lifting its shares to record-high territory and...', 'title': 'Nvidia forecasts quarterly revenue above estimates, unveils stock split', 'source': 'Reuters', 'pos_overall': 9, 'relative_publish_date': '22 hours ago'}, {'url': 'https://www.barrons.com/livecoverage/stock-market-today-052324', 'desc': 'The Dow Jones Industrial Average was trading lower today, while the S&P 500 \nand Nasdaq Composite rose. Technology was the only major sector...', 'title': 'Stock Market News From May 23, 2024: Dow Down 600 Points, Nasdaq Surges on \nNvidia Earnings, and More Stock ...', 'source': ""Barron's"", 'pos_overall': 10, 'relative_publish_date': '3 hours ago'}]",,3,12000
2024-05-24 03:08:18,2024-05-24 03:08:23,4,https://www.google.com/search?q=nvidia+stock&tbm=nws&uule=w+CAIQICIFaW5kaWE&gl=in&hl=en&start=30,7199607116460479489,200,,https://www.google.com/search?q=nvidia+stock&tbm=nws&uule=w+CAIQICIFaW5kaWE&gl=in&hl=en&start=30,4,"[{'url': 'https://www.investors.com/research/nvda-stock-is-nvidia-a-buy/', 'desc': 'Nvidia (NVDA) gapped to record highs after first-quarter results beat \nestimates yet again late Wednesday. Shares have cleared the...', 'title': 'Nvidia Passes Test As Q1 Results Impress; Is It A Buy Now?', 'source': ""Investor's Business Daily"", 'pos_overall': 1, 'relative_publish_date': '12 hours ago'}, {'url': 'https://www.morningstar.com/markets/what-does-nvidias-stock-split-mean-investors', 'desc': 'Semiconductor firm Nvidia NVDA announced a 10-for-1 stock split along with \nits blowout first-quarter earnings results on Wednesday.', 'title': ""What Does Nvidia's Stock Split Mean for Investors?"", 'source': 'Morningstar', 'pos_overall': 2, 'relative_publish_date': '7 hours ago'}, {'url': 'https://www.cnbctv18.com/personal-finance/nvidia-shares-stock-price-mutual-funds-schemes-exposure-how-to-invest-india-motilal-kotak-axis-19416277.htm', 'desc': ""As NVIDIA shares hit record highs, here's a look at Indian mutual fund \nschemes with notable exposure to the tech giant."", 'title': 'These mutual fund schemes invest in Nvidia shares: Do you hold any?', 'source': 'cnbctv18', 'pos_overall': 3, 'relative_publish_date': '23 hours ago'}, {'url': 'https://apnews.com/article/nvidia-artificial-intelligence-chips-stock-market-value-f1d89b8ec62f3a8556e332a46c39507c', 'desc': ""Nvidia's stock price has more than doubled this year, increasing the \ncompany's market value by more than $1.3 trillion."", 'title': 'How Nvidia rose to AI prominence', 'source': 'AP News', 'pos_overall': 4, 'relative_publish_date': '6 hours ago'}, {'url': 'https://finance.yahoo.com/news/dollar-firms-us-yields-rise-222127525.html', 'desc': '(Bloomberg) -- Stocks and bonds retreated as data showing US business \nactivity accelerated amid a pickup in inflation reinforced bets the...', 'title': 'Stocks Join Bonds in Falling as Fed-Cut Bets Wane: Markets Wrap (Bloomberg)', 'source': 'Yahoo Finance', 'pos_overall': 5, 'relative_publish_date': '6 hours ago'}, {'url': 'https://www.reuters.com/markets/us/nasdaq-sp-500-futures-pop-nvidia-fuels-chip-stocks-rally-2024-05-23/', 'desc': 'U.S. stocks ended lower on Thursday, even as a strong revenue forecast for \nNvidia fueled a surge in its shares, but that was overshadowed by...', 'title': 'Stocks fall despite Nvidia boost as inflation concerns weigh', 'source': 'Reuters', 'pos_overall': 6, 'relative_publish_date': '4 hours ago'}, {'url': 'https://www.barrons.com/articles/nvidia-earnings-stock-price-479e7016', 'desc': ""fulfilled the world's high expectations with its April quarter results. The \nhurdle was high, given that many now consider it the most..."", 'title': 'Nvidia Stock Rises on Strong Earnings', 'source': ""Barron's"", 'pos_overall': 7, 'relative_publish_date': '10 hours ago'}, {'url': 'https://finance.yahoo.com/news/10-shocking-points-nvidia-stock-143045932.html', 'desc': ""In today's video, I discuss recent updates impacting Nvidia (NASDAQ: NVDA). \nCheck out the short video to learn more, consider subscribing,..."", 'title': '10 Shocking Points Nvidia Stock Investors Should Know After Earnings', 'source': 'Yahoo Finance', 'pos_overall': 8, 'relative_publish_date': '13 hours ago'}, {'url': 'https://www.fool.com/investing/2024/05/23/nvda-stock-earnings-stock-split-ai-stocks/', 'desc': 'In fiscal Q1, the tech giant continued to experience powerful demand for \nits products and services that enable artificial intelligence (AI)...', 'title': 'Nvidia Stock Pops on Blockbuster Earnings Report and Stock Split Plan', 'source': 'The Motley Fool', 'pos_overall': 9, 'relative_publish_date': '14 hours ago'}, {'url': 'https://www.investopedia.com/how-an-earnings-fueled-move-in-nvidia-stock-price-could-affect-the-broader-market-8652271', 'desc': 'Nvidia is set to report first-quarter earnings after markets close \nWednesday, with analysts and traders anticipating moves in the...', 'title': ""How an Earnings-Fueled Move in Nvidia's Stock Price Could Affect the \nBroader Market"", 'source': 'Investopedia', 'pos_overall': 10, 'relative_publish_date': '1 day ago'}]",,4,12000
2024-05-24 03:08:18,2024-05-24 03:08:23,5,https://www.google.com/search?q=nvidia+stock&tbm=nws&uule=w+CAIQICIFaW5kaWE&gl=in&hl=en&start=40,7199607116460479489,200,,https://www.google.com/search?q=nvidia+stock&tbm=nws&uule=w+CAIQICIFaW5kaWE&gl=in&hl=en&start=40,5,"[{'url': 'https://www.forbes.com/sites/dereksaul/2024/05/22/nvidia-earnings-stock-rallies-as-ai-giant-reports-600-profit-explosion/', 'desc': 'Nvidia again shattered Wall Street forecasts in its anxiously awaited \nearnings report Wednesday afternoon, sending shares of the chip...', 'title': 'Nvidia Earnings: Stock Rallies As AI Giant Reports 600% Profit Explosion, \nStock Split', 'source': 'Forbes', 'pos_overall': 1, 'relative_publish_date': '1 day ago'}, {'url': 'https://www.forbes.com/sites/jimosman/2024/05/22/nvidia-are-splitting-10-for-1-heres-what-it-means-and-how-to-profit/', 'desc': ""Nvidia announced a 10-for-1 forward stock split in today's first-quarter \nearnings report."", 'title': 'Nvidia Stock Is Splitting 10-For-1: What It Means And How To Profit', 'source': 'Forbes', 'pos_overall': 2, 'relative_publish_date': '1 day ago'}, {'url': 'https://www.marketwatch.com/livecoverage/nvidia-stock-earnings-reaction-price-ai-chip-blackwell', 'desc': 'Nvidia shares gained Thursday in the face of upbeat results and commentary \nfrom the chip giant. MarketWatch broke down the reaction live.', 'title': 'Nvidia earnings: Stock racks up big gains as Wall Street cheers the future', 'source': 'MarketWatch', 'pos_overall': 3, 'relative_publish_date': '6 hours ago'}, {'url': 'https://www.investing.com/news/stock-market-news/nvidia-stock-10-wall-street-analysts-discuss-earnings-outlook-3454004', 'desc': 'Nvidia (NASDAQ:NVDA) stock surpassed $1,000 for the first time in extended \ntrading on Wednesday after the chipmaker reported fiscal...', 'title': 'Nvidia stock: 10 Wall Street analysts discuss earnings, outlook', 'source': 'Investing.com', 'pos_overall': 4, 'relative_publish_date': '16 hours ago'}, {'url': 'https://www.reuters.com/markets/us/futures-muted-nvidia-results-fed-minutes-test-wall-sts-record-run-2024-05-22/', 'desc': ""U.S. stocks fell on Wednesday as investors digested minutes of the Federal \nReserve's most recent meeting but Nvidia's shares rose about 6%..."", 'title': 'Stocks fall after Fed minutes; Nvidia shares climb after the bell', 'source': 'Reuters', 'pos_overall': 5, 'relative_publish_date': '1 day ago'}, {'url': 'https://www.investors.com/news/technology/nvidia-rosy-outlook-data-center-networking-chips-pressures-arista/', 'desc': 'Arista stock fell amid rosy commentary by Nvidia management on its \nnetworking business on its Q1 earnings call with analysts.', 'title': ""Nvidia's Rosy Outlook On Data Center Networking Chips Pressures Arista"", 'source': ""Investor's Business Daily"", 'pos_overall': 6, 'relative_publish_date': '11 hours ago'}, {'url': 'https://markets.businessinsider.com/news/stocks/stock-market-today-nvidia-q1-earnings-split-chips-ai-blackwell-2024-5', 'desc': ""Stocks jumped Thursday with investors feeling buoyant after Nvidia's big \nfirst-quarter earnings report. The chip maker beat revenue and..."", 'title': ""Stock Market Today: Indexes Pop After Nvidia's Blowout Earnings Report"", 'source': 'markets.businessinsider.com', 'pos_overall': 7, 'relative_publish_date': '14 hours ago'}, {'url': 'https://www.investors.com/research/ibd-stock-analysis/microsoft-stock-msft-nvidia-servicenow/', 'desc': 'Magnificent Seven stocks like Amazon.com (AMZN), Alphabet (GOOGL), Nvidia \n(NVDA) and even a rebounding Apple (AAPL) continue to make good on...', 'title': 'Microsoft Stock Copilots AI Boom With ServiceNow As Nvidia Smashes Targets \nAgain', 'source': ""Investor's Business Daily"", 'pos_overall': 8, 'relative_publish_date': '7 hours ago'}, {'url': 'https://www.investopedia.com/nvidia-earnings-surge-pulls-up-nasdaq-chip-etfs-and-others-in-ai-ecosystem-8652850', 'desc': ""Nvidia shares surged following the chipmaker's better-than-expecting \nearnings report, boosting major indexes and exchange-traded funds..."", 'title': 'Nvidia Earnings Surge Pulls Up Nasdaq, Chip ETFs, and Others in AI Ecosystem', 'source': 'Investopedia', 'pos_overall': 9, 'relative_publish_date': '12 hours ago'}, {'url': 'https://markets.businessinsider.com/news/stocks/nvidia-q1-earnings-wall-street-reaction-ai-revolution-just-started-2024-5', 'desc': 'Nvidia stock soared 9% on Thursday to record highs after its reported \nearnings. The company defied analyst expectations yet again,...', 'title': 'Nvidia Q1 Earnings Wall Street Reaction: AI Revolution Just Started', 'source': 'markets.businessinsider.com', 'pos_overall': 10, 'relative_publish_date': '13 hours ago'}]",,5,12000
2024-05-24 03:08:18,2024-05-24 03:08:24,6,https://www.google.com/search?q=nvidia+stock&tbm=nws&uule=w+CAIQICIFaW5kaWE&gl=in&hl=en&start=50,7199607116460479489,200,,https://www.google.com/search?q=nvidia+stock&tbm=nws&uule=w+CAIQICIFaW5kaWE&gl=in&hl=en&start=50,6,"[{'url': 'https://finance.yahoo.com/news/nvidia-announces-10-1-stock-165831783.html', 'desc': 'Nvidia (NVDA), the semiconductor tech giant at the heart of the AI boom, \nannounced plans for a stock split Tuesday, May 22 that could make...', 'title': ""Nvidia announces 10-1 stock split. Here's what it means for investors"", 'source': 'Yahoo Finance', 'pos_overall': 1, 'relative_publish_date': '10 hours ago'}, {'url': 'https://www.barrons.com/articles/nvidia-ai-stock-intel-dow-average-d2851514', 'desc': ""'s blowout earnings show that the artificial-intelligence revolution isn't \nclose to peaking anytime soon. Nvidia is clearly a bellwether for..."", 'title': ""Hello Nvidia, Goodbye Intel? What the AI Stock's Split Could Mean for the \nDow."", 'source': ""Barron's"", 'pos_overall': 2, 'relative_publish_date': '7 hours ago'}, {'url': 'https://finance.yahoo.com/video/nvidia-announces-10-1-stock-155257208.html', 'desc': ""In Nvidia's (NVDA) broad earnings beat reported on Wednesday, the chip \ngiant announced a 10-for-1 stock split to be implemented for current..."", 'title': 'Nvidia announces 10-for-1 stock split. What does this mean?', 'source': 'Yahoo Finance', 'pos_overall': 3, 'relative_publish_date': '11 hours ago'}, {'url': 'https://www.thestreet.com/investing/stocks/analysts-overhaul-nvidia-price-targets-as-earnings-address-key-problem-', 'desc': ""Nvidia's one potential weakness was directly addressed by CEO Jensen Huang."", 'title': 'Analysts overhaul Nvidia stock price targets as earnings address key problem', 'source': 'TheStreet', 'pos_overall': 4, 'relative_publish_date': '13 hours ago'}, {'url': 'https://www.cnbc.com/2024/05/22/nvidia-announces-10-for-1-stock-split.html', 'desc': 'Alongside its quarterly earnings report on Wednesday, Nvidia announced a \n10-for-1 stock split in step with similar moves by other Big Tech...', 'title': 'Nvidia announces 10-for-1 stock split after AI-driven boom in share price', 'source': 'CNBC', 'pos_overall': 5, 'relative_publish_date': '1 day ago'}, {'url': 'https://www.investors.com/news/technology/nvidia-stock-nvda-fiscal-q1-2025-earnings/', 'desc': 'Nvidia stock jumped late, signaling a record high, after the AI chipmaker \ndelivered first-quarter results and second-quarter guidance.', 'title': 'Nvidia Stock Jumps To Record High On Q1 Earnings', 'source': ""Investor's Business Daily"", 'pos_overall': 6, 'relative_publish_date': '1 day ago'}, {'url': 'https://www.ft.com/content/75ac7f61-071a-437c-a35e-09f968c6a568', 'desc': ""Amazon's cloud computing arm has changed its plans to use Nvidia's most \nadvanced “superchip” to wait for a more powerful new model,..."", 'title': ""Amazon changes plans to order Nvidia 'superchip' to await updated model"", 'source': 'Financial Times', 'pos_overall': 7, 'relative_publish_date': '2 days ago'}, {'url': 'https://www.forbes.com/sites/dereksaul/2024/05/21/nvidia-stock-hits-record-high-ahead-of-blockbuster-earnings/', 'desc': 'Nvidia stock closed at a new all-time high Tuesday ahead of its hotly \nanticipated earnings report due this week, as the top investor pick...', 'title': 'Nvidia Stock Hits Record High Ahead Of Blockbuster Earnings', 'source': 'Forbes', 'pos_overall': 8, 'relative_publish_date': '2 days ago'}, {'url': 'https://www.investopedia.com/dow-jones-today-05222024-8652227', 'desc': ""U.S. stocks slid from record highs on Wednesday after the minutes of the \nFederal Reserve's May meeting highlighted officials' inflation..."", 'title': 'Dow Jones Today: Stocks Slip as Fed Minutes Spook Investors Ahead of Nvidia \nEarnings', 'source': 'Investopedia', 'pos_overall': 9, 'relative_publish_date': '1 day ago'}, {'url': 'https://www.wsj.com/tech/ai/nvidias-business-is-booming-heres-what-could-slow-it-down-fd5ffa14', 'desc': 'After tripling sales for three quarters, Nvidia faces new competition and a \nshifting AI market.', 'title': ""Nvidia's Business Is Booming. Here's What Could Slow It Down."", 'source': 'WSJ', 'pos_overall': 10, 'relative_publish_date': '6 hours ago'}]",,6,12000
