created_at,updated_at,page,url,job_id,status_code,parser_type,content.url,content.page,content.results.main,content.results.additional,content.results.total_results_count,content.parse_status_code
2024-05-24 03:04:36,2024-05-24 03:04:39,1,https://www.google.com/search?q=nvidia+stock&tbm=nws&uule=w+CAIQICINdW5pdGVkIHN0YXRlcw&gl=us&hl=en,7199606184179936257,200,,https://www.google.com/search?q=nvidia+stock&tbm=nws&uule=w+CAIQICINdW5pdGVkIHN0YXRlcw&gl=us&hl=en,1,"[{'url': 'https://finance.yahoo.com/news/nvidia-stock-pops-11-tops-1000-after-earnings-beat-forecasts-announces-stock-split-and-dividend-hike-202405359.html', 'desc': ""Nvidia reported its fiscal first quarter earnings after the bell on \nWednesday, beating analysts' expectations on the top and bottom lines..."", 'title': 'Nvidia stock pops 9%, tops $1,000 after earnings beat forecasts, announces \nstock split and dividend hike', 'source': 'Yahoo Finance', 'pos_overall': 1, 'relative_publish_date': '16 hours ago'}, {'url': 'https://www.fool.com/investing/2024/05/22/nvidia-announces-a-10-for-1-stock-split-heres-what/', 'desc': 'Recent developments in the field of artificial intelligence (AI) have \ncaptured the public imagination over the past year or so.', 'title': ""Nvidia Announces a 10-for-1 Stock Split. Here's What Investors Need to Know."", 'source': 'The Motley Fool', 'pos_overall': 2, 'relative_publish_date': '1 day ago'}, {'url': 'https://www.foxbusiness.com/markets/nvidia-shares-stock-split', 'desc': 'Nvidia is cashing in on the AI boom it has been driving by giving investors \na hefty 10-for-1 stock split as revenues continue to grow faster...', 'title': 'Nvidia announces 10-for-1 stock split, shares hit $1,000', 'source': 'Fox Business', 'pos_overall': 3, 'relative_publish_date': '14 hours ago'}, {'url': 'https://www.reuters.com/markets/us/nasdaq-sp-500-futures-pop-nvidia-fuels-chip-stocks-rally-2024-05-23/', 'desc': 'U.S. stocks ended lower on Thursday, even as a strong revenue forecast for \nNvidia fueled a surge in its shares, but that was overshadowed by...', 'title': 'Stocks fall despite Nvidia boost as inflation concerns weigh', 'source': 'Reuters', 'pos_overall': 4, 'relative_publish_date': '4 hours ago'}, {'url': 'https://www.cnbc.com/2024/05/23/stocks-making-the-biggest-moves-before-the-bell-nvda-lyv-snow.html', 'desc': 'Unlock this article by creating a free CNBC account. Benefits include \ncreating stock watchlists and more. Already have a CNBC account?', 'title': 'Stocks making the biggest moves before the bell: NVDA, LYV, SNOW', 'source': 'CNBC', 'pos_overall': 5, 'relative_publish_date': '15 hours ago'}]","[[], [], [], [], []]",12400,12000
2024-05-24 03:04:36,2024-05-24 03:04:41,2,https://www.google.com/search?q=nvidia+stock&tbm=nws&uule=w+CAIQICINdW5pdGVkIHN0YXRlcw&gl=us&hl=en&start=10,7199606184179936257,200,,https://www.google.com/search?q=nvidia+stock&tbm=nws&uule=w+CAIQICINdW5pdGVkIHN0YXRlcw&gl=us&hl=en&start=10,2,"[{'url': 'https://www.wsj.com/livecoverage/stock-market-today-dow-jones-earnings-05-23-2024/card/why-is-nvidia-splitting-its-stock-and-what-will-the-10-for-1-split-mean--eWfPUbLYiRzTtr7XWoiB', 'desc': ""Alongside another blockbuster earnings report, Nvidia said it planned to \nsplit its stock. Here's a look at what that means: Why is Nvidia..."", 'title': ""What Nvidia's 10-for-1 Stock Split Will Mean for Investors"", 'source': 'WSJ', 'pos_overall': 1, 'relative_publish_date': '4 hours ago'}, {'url': 'https://www.investors.com/news/technology/nvidia-stock-breaks-out-on-q1-beat-and-raise-report/', 'desc': 'AI chip leader Nvidia topped even Wall Street\'s elevated ""whisper numbers"" \nwith its fiscal Q1 results and guidance. Nvidia stock rose.', 'title': 'Nvidia Stock Breaks Out On Jaw-Dropping Q1 Results, Outlook', 'source': ""Investor's Business Daily"", 'pos_overall': 2, 'relative_publish_date': '7 hours ago'}, {'url': 'https://www.morningstar.com/markets/what-does-nvidias-stock-split-mean-investors', 'desc': 'Semiconductor firm Nvidia NVDA announced a 10-for-1 stock split along with \nits blowout first-quarter earnings results on Wednesday.', 'title': ""What Does Nvidia's Stock Split Mean for Investors?"", 'source': 'Morningstar', 'pos_overall': 3, 'relative_publish_date': '7 hours ago'}, {'url': 'https://finance.yahoo.com/news/ai-heavyweight-nvidia-forecasts-quarterly-202236454.html', 'desc': 'Shares of Nvidia surged over 9% on Thursday, building on a stunning rally \nas its bumper revenue forecast reinforced investor confidence in...', 'title': 'Nvidia adds over $200 billion in market value in post-earnings rally', 'source': 'Yahoo Finance', 'pos_overall': 4, 'relative_publish_date': '6 hours ago'}, {'url': 'https://www.investopedia.com/nvidia-10-for-1-stock-split-is-coming-what-you-need-to-know-8652922', 'desc': 'Nvidia announced a 10-for-1 forward stock split along with its blockbuster \nearnings report Wednesday. Stock splits increase the number of...', 'title': ""Nvidia's 10-for-1 Stock Split Is Coming—What You Need To Know"", 'source': 'Investopedia', 'pos_overall': 5, 'relative_publish_date': '9 hours ago'}, {'url': 'https://www.fool.com/investing/2024/05/23/nvda-stock-earnings-stock-split-ai-stocks/', 'desc': 'In fiscal Q1, the tech giant continued to experience powerful demand for \nits products and services that enable artificial intelligence (AI)...', 'title': 'Nvidia Stock Pops on Blockbuster Earnings Report and Stock Split Plan', 'source': 'The Motley Fool', 'pos_overall': 6, 'relative_publish_date': '14 hours ago'}, {'url': 'https://www.reuters.com/markets/us/nvidias-split-soaring-stock-could-boost-retail-investor-appeal-dow-chances-2024-05-23/', 'desc': ""Nvidia's plan to split its stock after the stunning rise in the chipmaker's \nshare price could lure more interest from retail investors while..."", 'title': ""Nvidia's split of soaring stock could boost retail investor appeal, Dow \nchances"", 'source': 'Reuters', 'pos_overall': 7, 'relative_publish_date': '11 hours ago'}, {'url': 'https://www.barrons.com/articles/nvidia-earnings-stock-price-479e7016', 'desc': ""fulfilled the world's high expectations with its April quarter results. The \nhurdle was high, given that many now consider it the most..."", 'title': 'Nvidia Stock Rises on Strong Earnings', 'source': ""Barron's"", 'pos_overall': 8, 'relative_publish_date': '10 hours ago'}, {'url': 'https://www.cnbc.com/2024/05/23/what-nvidia-stock-split-means-for-investors.html', 'desc': 'Nvidia released its fiscal first-quarter earnings report on Wednesday, \nalong with news of a planned 10-for-1 stock split.', 'title': ""What Nvidia's 10-for-1 stock split means for investors—it's mostly \npsychological"", 'source': 'CNBC', 'pos_overall': 9, 'relative_publish_date': '10 hours ago'}, {'url': 'https://www.thestreet.com/investing/stocks/analysts-overhaul-nvidia-price-targets-as-earnings-address-key-problem-', 'desc': ""Nvidia's one potential weakness was directly addressed by CEO Jensen Huang."", 'title': 'Analysts overhaul Nvidia stock price targets as earnings address key problem', 'source': 'TheStreet', 'pos_overall': 10, 'relative_publish_date': '13 hours ago'}]",,2,12000
2024-05-24 03:04:36,2024-05-24 03:04:43,3,https://www.google.com/search?q=nvidia+stock&tbm=nws&uule=w+CAIQICINdW5pdGVkIHN0YXRlcw&gl=us&hl=en&start=20,7199606184179936257,200,,https://www.google.com/search?q=nvidia+stock&tbm=nws&uule=w+CAIQICINdW5pdGVkIHN0YXRlcw&gl=us&hl=en&start=20,3,"[{'url': 'https://apnews.com/article/nvidia-artificial-intelligence-chips-stock-market-value-f1d89b8ec62f3a8556e332a46c39507c', 'desc': ""Nvidia's stock price has more than doubled this year, increasing the \ncompany's market value by more than $1.3 trillion."", 'title': 'How Nvidia rose to AI prominence', 'source': 'AP News', 'pos_overall': 1, 'relative_publish_date': '6 hours ago'}, {'url': 'https://investorplace.com/2024/05/nvidia-stock-split-alert-what-a-10-for-1-nvda-split-means-for-you/', 'desc': ""An Nvidia stock split is scheduled for the first week of June, 2024. Here's \nwhy this is good news for investors and for NVDA stock."", 'title': 'Nvidia Stock Split Alert: What a 10-for-1 NVDA Split Means for You', 'source': 'InvestorPlace', 'pos_overall': 2, 'relative_publish_date': '11 hours ago'}, {'url': 'https://www.businessinsider.com/nvidia-stock-price-split-earnings-ai-tech-microchips-investing-index-2024-5', 'desc': 'Nvidia announced a 10-for-1 stock split with the goal of making its $1000 \nshares more accessible to employees and investors.', 'title': 'Investing in Nvidia will get a whole lot cheaper after stock split', 'source': 'Business Insider', 'pos_overall': 3, 'relative_publish_date': '13 hours ago'}, {'url': 'https://www.fool.com/investing/2024/05/23/is-nvidia-stock-still-a-buy-after-it-just-popped-a/', 'desc': ""Nvidia's (NVDA 9.32%) latest earnings report was arguably the most highly \nanticipated of this earnings season."", 'title': 'Is Nvidia Stock Still a Buy After It Just Popped Again?', 'source': 'The Motley Fool', 'pos_overall': 4, 'relative_publish_date': '11 hours ago'}, {'url': 'https://finance.yahoo.com/video/nvidia-stock-split-wont-change-140125043.html', 'desc': 'Nvidia (NVDA) issued its first quarter results on Wednesday afternoon, \nbeating Wall Street expectations and announcing a 10-for-1 stock...', 'title': ""Nvidia stock split won't change much, but still a buy: Analyst"", 'source': 'Yahoo Finance', 'pos_overall': 5, 'relative_publish_date': '13 hours ago'}, {'url': 'https://www.investors.com/research/nvda-stock-is-nvidia-a-buy/', 'desc': 'Nvidia (NVDA) gapped to record highs after first-quarter results beat \nestimates yet again late Wednesday. Shares have cleared the...', 'title': 'Nvidia Passes Test As Q1 Results Impress; Is It A Buy Now?', 'source': ""Investor's Business Daily"", 'pos_overall': 6, 'relative_publish_date': '12 hours ago'}, {'url': 'https://finance.yahoo.com/news/dollar-firms-us-yields-rise-222127525.html', 'desc': '(Bloomberg) -- Stocks and bonds retreated as data showing US business \nactivity accelerated amid a pickup in inflation reinforced bets the...', 'title': 'Stocks Join Bonds in Falling as Fed-Cut Bets Wane: Markets Wrap (Bloomberg)', 'source': 'Yahoo Finance', 'pos_overall': 7, 'relative_publish_date': '6 hours ago'}, {'url': 'https://www.investors.com/market-trend/stock-market-today/dow-jones-futures-nvidia-earnings-nvda-stock/', 'desc': 'Dow Jones futures: Nvidia earnings boomed and the CEO touted the ""next \nindustrial revolution."" NVDA stock jumped and other AI plays rose.', 'title': 'Dow Jones Futures Rise; Nvidia Stock Tops 1,000 On Earnings, Other AI Plays \nRally', 'source': ""Investor's Business Daily"", 'pos_overall': 8, 'relative_publish_date': '15 hours ago'}, {'url': 'https://thehill.com/policy/technology/4682121-nvidia-stocks-high-earnings-stock-split/', 'desc': 'Shares of chipmaker Nvidia reached an all-time high Thursday after the \ncompany reported better-than-expected first quarter earnings and...', 'title': 'Nvidia stock reaches all-time high after strong earnings, share split', 'source': 'The Hill', 'pos_overall': 9, 'relative_publish_date': '10 hours ago'}, {'url': 'https://www.marketwatch.com/story/nvidias-stock-surge-at-odds-with-the-s-p-500-to-a-degree-not-seen-in-8-years-c49022f8', 'desc': ""Nvidia has been a big driver of the market over the past year. But its \nmight wasn't enough on Thursday, as the chip stock saw big gains..."", 'title': 'Nvidia’s stock surge at odds with the S&P 500 — to a degree not seen in 8 \nyears', 'source': 'MarketWatch', 'pos_overall': 10, 'relative_publish_date': '6 hours ago'}]",,3,12000
2024-05-24 03:04:36,2024-05-24 03:04:44,4,https://www.google.com/search?q=nvidia+stock&tbm=nws&uule=w+CAIQICINdW5pdGVkIHN0YXRlcw&gl=us&hl=en&start=30,7199606184179936257,200,,https://www.google.com/search?q=nvidia+stock&tbm=nws&uule=w+CAIQICINdW5pdGVkIHN0YXRlcw&gl=us&hl=en&start=30,4,"[{'url': 'https://finance.yahoo.com/news/nvidia-announces-10-1-stock-165831783.html', 'desc': 'Nvidia (NVDA), the semiconductor tech giant at the heart of the AI boom, \nannounced plans for a stock split Tuesday, May 22 that could make...', 'title': ""Nvidia announces 10-1 stock split. Here's what it means for investors"", 'source': 'Yahoo Finance', 'pos_overall': 1, 'relative_publish_date': '10 hours ago'}, {'url': 'https://finance.yahoo.com/news/10-shocking-points-nvidia-stock-143045932.html', 'desc': ""In today's video, I discuss recent updates impacting Nvidia (NASDAQ: NVDA). \nCheck out the short video to learn more, consider subscribing,..."", 'title': '10 Shocking Points Nvidia Stock Investors Should Know After Earnings', 'source': 'Yahoo Finance', 'pos_overall': 2, 'relative_publish_date': '13 hours ago'}, {'url': 'https://finance.yahoo.com/video/nvidia-announces-10-1-stock-155257208.html', 'desc': ""In Nvidia's (NVDA) broad earnings beat reported on Wednesday, the chip \ngiant announced a 10-for-1 stock split to be implemented for current..."", 'title': 'Nvidia announces 10-for-1 stock split. What does this mean?', 'source': 'Yahoo Finance', 'pos_overall': 3, 'relative_publish_date': '11 hours ago'}, {'url': 'https://www.reuters.com/technology/ai-heavyweight-nvidia-forecasts-quarterly-revenue-above-estimates-2024-05-22/', 'desc': 'Nvidia forecast quarterly revenue above estimates on Wednesday and \nannounced a stock split, lifting its shares to record-high territory and...', 'title': 'Nvidia forecasts quarterly revenue above estimates, unveils stock split', 'source': 'Reuters', 'pos_overall': 4, 'relative_publish_date': '22 hours ago'}, {'url': 'https://www.fool.com/investing/2024/05/23/10-shocking-points-nvidia-stock-investors-should-k/', 'desc': 'Nvidia is building a colossal cash position, but what will it do with it?', 'title': '10 Shocking Points Nvidia Stock Investors Should Know After Earnings', 'source': 'The Motley Fool', 'pos_overall': 5, 'relative_publish_date': '13 hours ago'}, {'url': 'https://www.cnbc.com/2024/05/23/nvidia-keeps-hitting-records-can-investors-still-buy-the-stock.html', 'desc': ""Shares of Nvidia surged to record highs Thursday, following the artificial \nintelligence chip giant's after-the-bell quarterly results that..."", 'title': 'Nvidia stock keeps hitting records. Can investors with little to no shares \nstill buy?', 'source': 'CNBC', 'pos_overall': 6, 'relative_publish_date': '7 hours ago'}, {'url': 'https://www.marketwatch.com/livecoverage/nvidia-stock-earnings-reaction-price-ai-chip-blackwell', 'desc': 'Nvidia shares gained Thursday in the face of upbeat results and commentary \nfrom the chip giant. MarketWatch broke down the reaction live.', 'title': 'Nvidia earnings: Stock racks up big gains as Wall Street cheers the future', 'source': 'MarketWatch', 'pos_overall': 7, 'relative_publish_date': '6 hours ago'}, {'url': 'https://www.investors.com/research/stock-screener-stocks-to-buy-watch/', 'desc': 'Featuring Nvidia, Cava, Chipotle and more, this stock screener highlights \ntop-rated stocks to watch right now.', 'title': 'Stock Screener: Nvidia Leads List Of Stocks To Watch', 'source': ""Investor's Business Daily"", 'pos_overall': 8, 'relative_publish_date': '7 hours ago'}, {'url': 'https://finance.yahoo.com/news/nvidia-stock-pops-9-tops-1000-after-earnings-beat-forecasts-it-announces-stock-split-and-dividend-hike-202405420.html', 'desc': 'Nvidia (NVDA) stock surged as much as 9% on Thursday, trading north of \n$1,000 in early trade and giving the chip giant a market cap above...', 'title': 'Nvidia stock pops 9%, tops $1,000 after earnings beat forecasts, it \nannounces stock split and dividend hike', 'source': 'Yahoo Finance', 'pos_overall': 9, 'relative_publish_date': '16 hours ago'}, {'url': 'https://www.barrons.com/articles/nvidia-ai-stock-intel-dow-average-d2851514', 'desc': ""'s blowout earnings show that the artificial-intelligence revolution isn't \nclose to peaking anytime soon. Nvidia is clearly a bellwether for..."", 'title': ""Hello Nvidia, Goodbye Intel? What the AI Stock's Split Could Mean for the \nDow."", 'source': ""Barron's"", 'pos_overall': 10, 'relative_publish_date': '7 hours ago'}]",,4,12000
2024-05-24 03:04:36,2024-05-24 03:04:46,5,https://www.google.com/search?q=nvidia+stock&tbm=nws&uule=w+CAIQICINdW5pdGVkIHN0YXRlcw&gl=us&hl=en&start=40,7199606184179936257,200,,https://www.google.com/search?q=nvidia+stock&tbm=nws&uule=w+CAIQICINdW5pdGVkIHN0YXRlcw&gl=us&hl=en&start=40,5,"[{'url': 'https://www.barrons.com/articles/nvidia-ai-stock-intel-dow-average-d2851514', 'desc': ""'s blowout earnings show that the artificial-intelligence revolution isn't \nclose to peaking anytime soon. Nvidia is clearly a bellwether for..."", 'title': ""Hello Nvidia, Goodbye Intel? What the AI Stock's Split Could Mean for the \nDow."", 'source': ""Barron's"", 'pos_overall': 1, 'relative_publish_date': '7 hours ago'}, {'url': 'https://pro.thestreet.com/market-commentary/nvidia-sucks-the-life-out-of-the-market', 'desc': 'Analysts and pundits are celebrating a terrific earnings report from \nNvidia, and the stock is up nearly 10% on the news.', 'title': 'Nvidia Sucks the Life Out of the Market', 'source': 'TheStreet Pro', 'pos_overall': 2, 'relative_publish_date': '11 hours ago'}, {'url': 'https://www.barrons.com/livecoverage/stock-market-today-052324', 'desc': 'The Dow Jones Industrial Average was trading lower today, while the S&P 500 \nand Nasdaq Composite rose. Technology was the only major sector...', 'title': 'Stock Market News From May 23, 2024: Dow Down 600 Points, Nasdaq Surges on \nNvidia Earnings, and More Stock ...', 'source': ""Barron's"", 'pos_overall': 3, 'relative_publish_date': '3 hours ago'}, {'url': 'https://finance.yahoo.com/news/nvidia-stock-pops-blockbuster-earnings-130139104.html', 'desc': ""Shares of Nvidia (NASDAQ: NVDA) jumped 6.1% in after-hours trading on \nWednesday following the artificial intelligence (AI) tech leader's..."", 'title': 'Nvidia Stock Pops on Blockbuster Earnings Report and Stock Split Plan', 'source': 'Yahoo Finance', 'pos_overall': 4, 'relative_publish_date': '14 hours ago'}, {'url': 'https://www.investopedia.com/how-an-earnings-fueled-move-in-nvidia-stock-price-could-affect-the-broader-market-8652271', 'desc': 'Nvidia is set to report first-quarter earnings after markets close \nWednesday, with analysts and traders anticipating moves in the...', 'title': ""How an Earnings-Fueled Move in Nvidia's Stock Price Could Affect the \nBroader Market"", 'source': 'Investopedia', 'pos_overall': 5, 'relative_publish_date': '1 day ago'}, {'url': 'https://www.investors.com/market-trend/stock-market-today/dow-jones-futures-nvidia-soars-deckers-jumps-late/', 'desc': 'Dow Jones futures: The stock market rally had an ugly session, despite \nNvidia surging on earnings. Deckers spiked late, signaling a...', 'title': 'Dow Jones Futures: Nvidia Soars But Stock Market Has Ugly Day; Deckers \nJumps Late', 'source': ""Investor's Business Daily"", 'pos_overall': 6, 'relative_publish_date': '23 minutes ago'}, {'url': 'https://www.wsj.com/livecoverage/stock-market-today-dow-jones-earnings-05-23-2024', 'desc': 'All 30 Dow components fall for the first time this year.', 'title': 'Stock Market News, May 23, 2024: Indexes Close Lower, Nvidia Extends Climb', 'source': 'WSJ', 'pos_overall': 7, 'relative_publish_date': '4 hours ago'}, {'url': 'https://www.usatoday.com/story/money/investing/2024/05/22/nvidia-stock-split-earnings-report/73808415007/', 'desc': 'Graphics and artificial intelligence company Nvidia announced a 10-for-one \nstock split as a part of its first quarter earnings release...', 'title': ""Nvidia announces 10-to-1 stock split: Here's everything to know"", 'source': 'USA Today', 'pos_overall': 8, 'relative_publish_date': '1 day ago'}, {'url': 'https://www.fool.com/investing/2024/05/23/nvidia-deliver-round-record-profit-ai-stock/', 'desc': ""Coming into Nvidia's (NVDA 9.32%) fiscal 2025 first-quarter earnings \nreport, expectations were sky-high. Nvidia stock has been the..."", 'title': 'Nvidia Did It Again. Is the AI Stock a Buy After Another Round of Record \nProfits?', 'source': 'The Motley Fool', 'pos_overall': 9, 'relative_publish_date': '14 hours ago'}, {'url': 'https://www.investopedia.com/where-is-nvidia-stock-price-headed-after-post-earnings-pop-8652786', 'desc': 'Nvidia shares jumped more than 6% in extended hours trading Wednesday \nevening after the AI darling delivered another blowout quarterly...', 'title': 'Where is Nvidia Stock Price Headed After Post-Earnings Pop?', 'source': 'Investopedia', 'pos_overall': 10, 'relative_publish_date': '1 day ago'}]",,5,12000
2024-05-24 03:04:36,2024-05-24 03:04:48,6,https://www.google.com/search?q=nvidia+stock&tbm=nws&uule=w+CAIQICINdW5pdGVkIHN0YXRlcw&gl=us&hl=en&start=50,7199606184179936257,200,,https://www.google.com/search?q=nvidia+stock&tbm=nws&uule=w+CAIQICINdW5pdGVkIHN0YXRlcw&gl=us&hl=en&start=50,6,"[{'url': 'https://www.investors.com/etfs-and-funds/sectors/sp500-how-much-10000-invested-in-nvidia-10-years-ago-is-worth-now/', 'desc': 'Shares of AI champion Nvidia keep racing higher. And now the money made on \nthe S&P 500 stock is at breathtaking levels.', 'title': 'How Much $10000 Invested In Nvidia 10 Years Ago Is Worth Now', 'source': ""Investor's Business Daily"", 'pos_overall': 1, 'relative_publish_date': '7 hours ago'}, {'url': 'https://www.axios.com/2024/05/22/nvidia-earnings-report-q1-fy25', 'desc': 'Nvidia\'s CEO Jensen Huang said Wednesday that demand for generative \nartificial intelligence training is ""accelerating,"" as the AI-chip...', 'title': 'Nvidia stock tops $1000 after strong earnings, 10-1 split announcement', 'source': 'Axios', 'pos_overall': 2, 'relative_publish_date': '1 day ago'}, {'url': 'https://www.investors.com/news/technology/nvidia-stock-nvda-fiscal-q1-2025-earnings/', 'desc': 'Nvidia stock jumped late, signaling a record high, after the AI chipmaker \ndelivered first-quarter results and second-quarter guidance.', 'title': 'Nvidia Stock Jumps To Record High On Q1 Earnings', 'source': ""Investor's Business Daily"", 'pos_overall': 3, 'relative_publish_date': '1 day ago'}, {'url': 'https://www.wsj.com/livecoverage/stock-market-today-dow-jones-earnings-05-22-2024/card/nvidia-earnings-what-to-watch-gT9ocnHyJbZTrkoCqgGx', 'desc': ""Nvidia shares rose in late trading after the company's latest quarterly \nresults beat analysts' expectations for sales and net income."", 'title': 'Nvidia Stock Rises After Earnings Beat Estimates, Company Announces \n10-for-1 Split', 'source': 'WSJ', 'pos_overall': 4, 'relative_publish_date': '1 day ago'}, {'url': 'https://www.investors.com/news/tesla-stock-nvidia-stock-jensen-huang/', 'desc': ""Tesla stock rose after Nvidia CEO Jensen Huang talked up Tesla's autonomous \ndriving efforts as his company eyes the auto industry's AI..."", 'title': ""Nvidia Chief Touts Auto Industry's AI Demand, Says Tesla 'Far Ahead'"", 'source': ""Investor's Business Daily"", 'pos_overall': 5, 'relative_publish_date': '7 hours ago'}, {'url': 'https://www.investing.com/news/stock-market-news/nvidia-tops-1000-a-share-in-afterhours-trading-on-strong-outlook-stock-split-3452885', 'desc': ""Investing.com -- Shares in Nvidia (NASDAQ:NVDA) gained more than 9% in \nThursday trading after the semiconductor group's much-anticipated..."", 'title': 'Nvidia shares rise more than 9% following latest revenue surge', 'source': 'Investing.com', 'pos_overall': 6, 'relative_publish_date': '18 hours ago'}, {'url': 'https://www.investing.com/news/stock-market-news/nvidia-stock-10-wall-street-analysts-discuss-earnings-outlook-3454004', 'desc': 'Nvidia (NASDAQ:NVDA) stock surpassed $1,000 for the first time in extended \ntrading on Wednesday after the chipmaker reported fiscal...', 'title': 'Nvidia stock: 10 Wall Street analysts discuss earnings, outlook', 'source': 'Investing.com', 'pos_overall': 7, 'relative_publish_date': '16 hours ago'}, {'url': 'https://www.investors.com/news/technology/nvidia-rosy-outlook-data-center-networking-chips-pressures-arista/', 'desc': 'Arista stock fell amid rosy commentary by Nvidia management on its \nnetworking business on its Q1 earnings call with analysts.', 'title': ""Nvidia's Rosy Outlook On Data Center Networking Chips Pressures Arista"", 'source': ""Investor's Business Daily"", 'pos_overall': 8, 'relative_publish_date': '10 hours ago'}, {'url': 'https://www.forbes.com/sites/dereksaul/2024/05/22/nvidia-earnings-stock-rallies-as-ai-giant-reports-600-profit-explosion/', 'desc': 'Nvidia again shattered Wall Street forecasts in its anxiously awaited \nearnings report Wednesday afternoon, sending shares of the chip...', 'title': 'Nvidia Earnings: Stock Rallies As AI Giant Reports 600% Profit Explosion, \nStock Split', 'source': 'Forbes', 'pos_overall': 9, 'relative_publish_date': '1 day ago'}, {'url': 'https://www.thestreet.com/investing/stocks/stock-market-today-nvidia-set-to-power-s-p-500-nasdaq-to-record-highs', 'desc': 'Stocks are set for another record-setting session following a blowout \nfirst-quarter earnings report from AI chipmaker Nvidia.', 'title': 'Stock Market Today: Nvidia soars, stocks edge lower on inflation risks', 'source': 'TheStreet', 'pos_overall': 10, 'relative_publish_date': '7 hours ago'}]",,6,12000
