created_at,updated_at,page,url,job_id,status_code,parser_type,content.url,content.page,content.results.main,content.results.additional,content.results.total_results_count,content.parse_status_code
2024-05-24 03:04:36,2024-05-24 03:04:49,7,https://www.google.com/search?q=nvidia+stock&tbm=nws&uule=w+CAIQICINdW5pdGVkIHN0YXRlcw&gl=us&hl=en&start=60,7199606184179936257,200,,https://www.google.com/search?q=nvidia+stock&tbm=nws&uule=w+CAIQICINdW5pdGVkIHN0YXRlcw&gl=us&hl=en&start=60,7,"[{'url': 'https://www.investors.com/research/magnificent-seven-stocks-to-buy-and-and-watch/', 'desc': ""Magnificent Seven stocks, including AI leader Nvidia, are among the best \nstocks to watch in today's stock market."", 'title': 'Magnificent Seven Stocks: Nvidia Stock Soars 10% On Earnings; Apple, Tesla \nSlide', 'source': ""Investor's Business Daily"", 'pos_overall': 1, 'relative_publish_date': '9 hours ago'}, {'url': 'https://apnews.com/article/nvidia-ai-chips-earnings-1c306de9f737f5bd8b82058e179093cf', 'desc': 'Nvidia overshot Wall Street estimates as its quarterly profit skyrocketed, \nbolstered by its chip-making dominance.', 'title': 'Nvidia earnings: Profit soars, underscoring its dominance in chips for AI', 'source': 'AP News', 'pos_overall': 2, 'relative_publish_date': '1 day ago'}, {'url': 'https://www.marketwatch.com/livecoverage/nvidia-earnings-stock-ai-expectations-results-revenue-q1', 'desc': ""Nvidia reported fiscal first-quarter earnings on Wednesday, beating Wall \nStreet's expectations. MarketWatch broke down the results live."", 'title': ""Nvidia earnings: Stock gains as Nvidia's outlook impresses yet again"", 'source': 'MarketWatch', 'pos_overall': 3, 'relative_publish_date': '1 day ago'}, {'url': 'https://www.cnbc.com/2024/05/22/nvidia-announces-10-for-1-stock-split.html', 'desc': 'Alongside its quarterly earnings report on Wednesday, Nvidia announced a \n10-for-1 stock split in step with similar moves by other Big Tech...', 'title': 'Nvidia announces 10-for-1 stock split after AI-driven boom in share price', 'source': 'CNBC', 'pos_overall': 4, 'relative_publish_date': '1 day ago'}, {'url': 'https://www.fool.com/investing/2024/05/21/nvidia-stock-just-got-spectacular-news-from-super/', 'desc': 'AI server demand is expected to continue to drive revenue growth for Nvidia.', 'title': 'Nvidia Stock Just Got Spectacular News From Super Micro and Dell \nTechnologies', 'source': 'The Motley Fool', 'pos_overall': 5, 'relative_publish_date': '2 days ago'}, {'url': 'https://www.thestreet.com/technology/nvidias-stock-surges-following-latest-earnings-report', 'desc': ""Nvidia's stock rallied nearly 5% in post-market trading on May 22 after CEO \nJensen Huang delivered another “beat and raise” quarter."", 'title': ""Nvidia's stock surges following latest earnings report"", 'source': 'TheStreet', 'pos_overall': 6, 'relative_publish_date': '1 day ago'}, {'url': 'https://finance.yahoo.com/news/nvidia-tops-1-000-heres-174544105.html', 'desc': 'Shares of Nvidia (NASDAQ: NVDA) were soaring again after the GPU superstar \nposted better-than-expected results in its first-quarter earnings...', 'title': ""Nvidia Tops $1,000. Here's Why the AI Stock Was Soaring Today."", 'source': 'Yahoo Finance', 'pos_overall': 7, 'relative_publish_date': '9 hours ago'}, {'url': 'https://www.investors.com/news/technology/nvidia-stock-semiconductor-stocks-ai-chips-qualcomm-lam-research/', 'desc': ""Nvidia stock wavered on a report that Amazon had halted orders of Nvidia's \ncurrent data center processors to wait for a more powerful model."", 'title': 'Nvidia Stock, Semiconductor Stocks Moving On News', 'source': ""Investor's Business Daily"", 'pos_overall': 8, 'relative_publish_date': '2 days ago'}, {'url': 'https://www.investors.com/research/ibd-stock-analysis/microsoft-stock-msft-nvidia-servicenow/', 'desc': 'Magnificent Seven stocks like Amazon.com (AMZN), Alphabet (GOOGL), Nvidia \n(NVDA) and even a rebounding Apple (AAPL) continue to make good on...', 'title': 'Microsoft Stock Copilots AI Boom With ServiceNow As Nvidia Smashes Targets \nAgain', 'source': ""Investor's Business Daily"", 'pos_overall': 9, 'relative_publish_date': '7 hours ago'}, {'url': 'https://finance.yahoo.com/news/nvidia-stock-retreats-from-record-high-ahead-of-crucial-first-quarter-earnings-report-133813203.html', 'desc': ""Nvidia (NVDA) reported its fiscal first quarter earnings after the bell on \nWednesday, beating Wall Street's expectations on both the top and..."", 'title': 'Nvidia stock retreats from record high ahead of crucial first quarter \nearnings report', 'source': 'Yahoo Finance', 'pos_overall': 10, 'relative_publish_date': '1 day ago'}]",,7,12000
2024-05-24 03:04:36,2024-05-24 03:04:51,8,https://www.google.com/search?q=nvidia+stock&tbm=nws&uule=w+CAIQICINdW5pdGVkIHN0YXRlcw&gl=us&hl=en&start=70,7199606184179936257,200,,https://www.google.com/search?q=nvidia+stock&tbm=nws&uule=w+CAIQICINdW5pdGVkIHN0YXRlcw&gl=us&hl=en&start=70,8,"[{'url': 'https://www.wsj.com/tech/nvidia-nvda-q1-earnings-report-2025-94306f1f', 'desc': ""CEO Jensen Huang gives better-than-expected outlook, saying demand remains \nstrong for the company's chips."", 'title': ""Nvidia's Sales Triple, Signaling AI Boom's Staying Power"", 'source': 'WSJ', 'pos_overall': 1, 'relative_publish_date': '17 hours ago'}, {'url': 'https://finance.yahoo.com/video/nvidia-announces-stock-split-posts-210444345.html', 'desc': 'Nvidia (NVDA) made a lot of headlines while posting its fiscal 2025 first \nquarter results. The tech giant posted adjusted earnings per share...', 'title': 'Nvidia announces stock split, posts Q1 earnings beat', 'source': 'Yahoo Finance', 'pos_overall': 2, 'relative_publish_date': '1 day ago'}, {'url': 'https://www.wsj.com/livecoverage/stock-market-today-dow-jones-earnings-05-22-2024', 'desc': 'The S&P 500 and Nasdaq Composite retreated from their record highs.', 'title': 'Stock Market News, May 22, 2024: Nvidia Shares Rise After Earnings Top \nExpectations', 'source': 'WSJ', 'pos_overall': 3, 'relative_publish_date': '17 hours ago'}, {'url': 'https://www.cnbc.com/2024/05/23/investing-alternatives-to-chasing-nvidias-stock-using-options-after-its-blockbuster-report.html', 'desc': 'Mike Khouw reviews a margin of safety trade on Nvidia.', 'title': ""Investing alternatives to chasing Nvidia's stock using options after its \nblockbuster report"", 'source': 'CNBC', 'pos_overall': 4, 'relative_publish_date': '11 hours ago'}, {'url': 'https://www.marketwatch.com/story/nvidias-stock-is-a-bargain-provided-this-pattern-continues-20ddefa8', 'desc': ""Nvidia's stock is trading lower to expected profit than it did three years \nago, before its AI-related sales exploded."", 'title': 'Nvidia’s stock is a bargain — provided this pattern continues', 'source': 'MarketWatch', 'pos_overall': 5, 'relative_publish_date': '3 days ago'}, {'url': 'https://www.reuters.com/markets/us/futures-muted-nvidia-results-fed-minutes-test-wall-sts-record-run-2024-05-22/', 'desc': ""U.S. stocks fell on Wednesday as investors digested minutes of the Federal \nReserve's most recent meeting but Nvidia's shares rose about 6%..."", 'title': 'Stocks fall after Fed minutes; Nvidia shares climb after the bell', 'source': 'Reuters', 'pos_overall': 6, 'relative_publish_date': '1 day ago'}, {'url': 'https://investorplace.com/2024/05/jpmorgan-just-raised-its-price-target-on-nvidia-nvda-stock/', 'desc': 'Nvidia assuaged concerns that enterprises will wait for its future superior \nproducts, leading to big price upgrades for NVDA stock.', 'title': 'JPMorgan Just Raised Its Price Target on Nvidia (NVDA) Stock', 'source': 'InvestorPlace', 'pos_overall': 7, 'relative_publish_date': '9 hours ago'}, {'url': 'https://www.wsj.com/tech/ai/nvidias-business-is-booming-heres-what-could-slow-it-down-fd5ffa14', 'desc': 'After tripling sales for three quarters, Nvidia faces new competition and a \nshifting AI market.', 'title': ""Nvidia's Business Is Booming. Here's What Could Slow It Down."", 'source': 'WSJ', 'pos_overall': 8, 'relative_publish_date': '6 hours ago'}, {'url': 'https://finance.yahoo.com/video/why-analyst-says-nvidia-not-213435366.html', 'desc': 'The moment markets have been eagerly awaiting has finally arrived. Nvidia \n(NVDA) has released its first quarter earnings report,...', 'title': 'Why this analyst says Nvidia is not a stock to buy', 'source': 'Yahoo Finance', 'pos_overall': 9, 'relative_publish_date': '1 day ago'}, {'url': 'https://finance.yahoo.com/news/3-reasons-buy-nvidia-stock-110000403.html', 'desc': 'If you want to bet on generative artificial intelligence (AI), there is \nstill no better pick than Nvidia (NASDAQ: NVDA).', 'title': '3 Reasons to Buy Nvidia Stock Right Now (and 1 Reason to Sell)', 'source': 'Yahoo Finance', 'pos_overall': 10, 'relative_publish_date': '1 day ago'}]",,8,12000
2024-05-24 03:04:36,2024-05-24 03:04:53,9,https://www.google.com/search?q=nvidia+stock&tbm=nws&uule=w+CAIQICINdW5pdGVkIHN0YXRlcw&gl=us&hl=en&start=80,7199606184179936257,200,,https://www.google.com/search?q=nvidia+stock&tbm=nws&uule=w+CAIQICINdW5pdGVkIHN0YXRlcw&gl=us&hl=en&start=80,9,"[{'url': 'https://www.thestreet.com/investing/stocks/nvidia-stock-hinges-on-5-key-things-in-its-earnings-report', 'desc': 'Nvidia is primed for a big move after its fiscal-first-quarter earnings \nreport Wednesday.', 'title': 'Nvidia stock hinges on 5 key things in its earnings report', 'source': 'TheStreet', 'pos_overall': 1, 'relative_publish_date': '1 day ago'}, {'url': 'https://www.forbes.com/sites/dereksaul/2024/05/21/nvidia-stock-hits-record-high-ahead-of-blockbuster-earnings/', 'desc': 'Nvidia stock closed at a new all-time high Tuesday ahead of its hotly \nanticipated earnings report due this week, as the top investor pick...', 'title': 'Nvidia Stock Hits Record High Ahead Of Blockbuster Earnings', 'source': 'Forbes', 'pos_overall': 2, 'relative_publish_date': '2 days ago'}, {'url': 'https://fortune.com/2024/05/22/nvidia-earnings-stock-split-jensen-huang-blackwell-ai/', 'desc': ""Markets breathed a sigh of relief after Nvidia's long-anticipated earnings \nreport comfortably beat expectations, with revenue up an..."", 'title': ""Nvidia announces threefold sales increase in another blowout earnings \nreport—'We're racing every day,' says CEO ..."", 'source': 'Fortune', 'pos_overall': 3, 'relative_publish_date': '1 day ago'}, {'url': 'https://www.barrons.com/articles/nvidia-earnings-stock-ai-d1845d84', 'desc': ""The year-ago quarter was Nvidia's last flat sales period, before demand for \nits artificial intelligence chips ignited."", 'title': ""Nvidia Stock Powers to Record Highs. Why There's Still 'Gas in the Tank'."", 'source': ""Barron's"", 'pos_overall': 4, 'relative_publish_date': '13 hours ago'}, {'url': 'https://finance.yahoo.com/news/nvidia-stock-pops-4-after-results-guidance-top-estimates-202405522.html', 'desc': 'Nvidia (NVDA) reported first quarter earnings after the bell on Wednesday \nthat topped expectations while also announcing a 10-for-1 stock...', 'title': 'Nvidia stock pops 4% after earnings beat forecasts, announcing stock split \nand dividend hike', 'source': 'Yahoo Finance', 'pos_overall': 5, 'relative_publish_date': '1 day ago'}, {'url': 'https://www.schaeffersresearch.com/content/news/2024/05/23/blowout-earnings-push-nvidia-stock-to-record-highs', 'desc': 'Nvidia (NVDA) stock is trading at record highs after blowout earnings and a \n10-for-1 stock split.', 'title': 'Blowout Earnings Push Nvidia Stock to Record Highs', 'source': ""Schaeffer's Investment Research"", 'pos_overall': 6, 'relative_publish_date': '13 hours ago'}, {'url': 'https://investorplace.com/2024/05/td-cowen-just-raised-its-price-target-on-nvidia-nvda-stock/', 'desc': 'Another earnings beat, another flurry of analyst price target hikes for \nWall Street darling Nvidia as NVDA stock pushes above $1000.', 'title': 'TD Cowen Just Raised Its Price Target on Nvidia (NVDA) Stock', 'source': 'InvestorPlace', 'pos_overall': 7, 'relative_publish_date': '8 hours ago'}, {'url': 'https://www.investors.com/news/technology/nvidia-stock-nvda-fiscal-q1-2025-earnings-preview/', 'desc': 'With Nvidia stock trading near its all-time high, investors are wondering \nif it has enough oxygen to continue its ascent.', 'title': 'Nvidia Stock Near Buy Point Ahead Of Q1 Report', 'source': ""Investor's Business Daily"", 'pos_overall': 8, 'relative_publish_date': '3 days ago'}, {'url': 'https://finance.yahoo.com/news/live/stock-market-today-stocks-add-to-losses-as-nvidia-rally-fails-to-lift-broader-market-133030256.html', 'desc': ""Nvidia's blockbuster earnings have fired up optimism for AI's ability to \nfuel growth, eclipsing rate-hike worries for now."", 'title': 'Stock market today: Stocks slide despite Nvidia earnings blowout', 'source': 'Yahoo Finance', 'pos_overall': 9, 'relative_publish_date': '8 hours ago'}, {'url': 'https://www.cnbc.com/2024/05/22/stock-market-today-live-updates.html', 'desc': 'Stocks declined Thursday as Wall Street assessed the latest quarterly \nresults from market bellwether Nvidia.', 'title': ""Dow falls 600 points in worst day of 2024 as Nvidia's blockbuster earnings \nfail to lift broader market: Live updates"", 'source': 'CNBC', 'pos_overall': 10, 'relative_publish_date': '7 hours ago'}]",,9,12000
2024-05-24 03:04:36,2024-05-24 03:04:55,10,https://www.google.com/search?q=nvidia+stock&tbm=nws&uule=w+CAIQICINdW5pdGVkIHN0YXRlcw&gl=us&hl=en&start=90,7199606184179936257,200,,https://www.google.com/search?q=nvidia+stock&tbm=nws&uule=w+CAIQICINdW5pdGVkIHN0YXRlcw&gl=us&hl=en&start=90,10,"[{'url': 'https://finance.yahoo.com/news/why-intel-stock-sliding-today-193224292.html', 'desc': 'A strong report from Nvidia seemed to be bad news for Intel.', 'title': 'Why Intel Stock Was Sliding Today', 'source': 'Yahoo Finance', 'pos_overall': 1, 'relative_publish_date': '8 hours ago'}, {'url': 'https://www.barrons.com/articles/tesla-stock-buy-sell-trading-range-3800409c', 'desc': 'Nvidia announces a big dividend hike and 10-for-1 stock split with its \nearnings report on Wednesday.', 'title': 'Tesla Got a Mention From Nvidia. Its Stock Is Down Anyway.', 'source': ""Barron's"", 'pos_overall': 2, 'relative_publish_date': '12 hours ago'}, {'url': 'https://www.fool.com/investing/2024/05/20/stock-split-watch-is-nvidia-next/', 'desc': 'With its share price around $950, Nvidia could be a candidate for another \nstock split.', 'title': 'Stock Split Watch: Is Nvidia Next?', 'source': 'The Motley Fool', 'pos_overall': 3, 'relative_publish_date': '3 days ago'}, {'url': 'https://www.investopedia.com/investors-expect-the-best-from-nvidia-earnings-what-that-could-mean-for-the-stock-8651022', 'desc': ""Nvidia shares rose Monday ahead of the company's high-stakes first-quarter \nearnings report, which will come after markets close on Wednesday..."", 'title': 'Investors Expect the Best From Nvidia Earnings—What That Could Mean for the \nStock', 'source': 'Investopedia', 'pos_overall': 4, 'relative_publish_date': '3 days ago'}, {'url': 'https://www.nasdaq.com/articles/stocks-fall-despite-nvidias-impressive-quarter', 'desc': 'The S&P 500 Index ($SPX ) (SPY ) today is down -0.70%, the Dow Jones \nIndustrials Index ($DOWI ) (DIA ) is down -1.53%, and the Nasdaq 100...', 'title': ""Stocks Fall Despite Nvidia's Impressive Quarter"", 'source': 'Nasdaq', 'pos_overall': 5, 'relative_publish_date': '9 hours ago'}, {'url': 'https://www.wsj.com/livecoverage/stock-market-today-dow-jones-05-20-2024/card/traders-brace-for-another-dizzying-swing-in-nvidia-shares-NF8fVdgJZidwI5dFySLk', 'desc': 'Traders are betting on another mammoth move in Nvidia shares this week. \nPricing in the options market shows that traders are wagering on a...', 'title': 'Traders Brace for a Big Swing in Nvidia Stock After Earnings', 'source': 'WSJ', 'pos_overall': 6, 'relative_publish_date': '3 days ago'}, {'url': 'https://www.reuters.com/markets/global-markets-wrapup-1-2024-05-23/', 'desc': ""U.S. stocks ended sharply lower on Thursday as enthusiasm over Nvidia's \nquarterly results faded and robust economic data fueled concerns..."", 'title': 'Wall Street tumbles as AI fervor dampened by rate jitters', 'source': 'Reuters', 'pos_overall': 7, 'relative_publish_date': '4 hours ago'}, {'url': 'https://www.investors.com/market-trend/stock-market-today/dow-jones-sp500-nasdaq-nvidia-earnings-nvda-stock/', 'desc': 'Stock Market Today: The Dow Jones dropped Thursday after jobless claims. \nNvidia stock surged above $1000 on strong earnings results.', 'title': 'Stock Market Today: Dow Jones Slides After Jobless Claims; Nvidia Surges On \nEarnings', 'source': ""Investor's Business Daily"", 'pos_overall': 8, 'relative_publish_date': '13 hours ago'}, {'url': 'https://www.fool.com/investing/2024/05/21/why-nvidia-stock-sustain-stunning-bull-run/', 'desc': ""One analyst predicts Nvidia's data center business will see massive growth \nthanks to its new AI chips."", 'title': ""Here's Why Nvidia Stock Could Sustain Its Stunning Bull Run After May 22"", 'source': 'The Motley Fool', 'pos_overall': 9, 'relative_publish_date': '2 days ago'}, {'url': 'https://finance.yahoo.com/video/arista-networks-stock-pressured-nvidias-194142862.html', 'desc': 'Arista Networks (ANET) shares tumble after chip giant Nvidia (NVDA) blew \npast its fiscal first-quarter 2025 earnings expectations.', 'title': ""Arista Networks stock pressured by Nvidia's networking goals"", 'source': 'Yahoo Finance', 'pos_overall': 10, 'relative_publish_date': '7 hours ago'}]",,10,12000
2024-05-24 03:04:36,2024-05-24 03:04:56,11,https://www.google.com/search?q=nvidia+stock&tbm=nws&uule=w+CAIQICINdW5pdGVkIHN0YXRlcw&gl=us&hl=en&start=100,7199606184179936257,200,,https://www.google.com/search?q=nvidia+stock&tbm=nws&uule=w+CAIQICINdW5pdGVkIHN0YXRlcw&gl=us&hl=en&start=100,11,"[{'url': 'https://www.fool.com/investing/2024/05/19/why-is-nvidias-stock-price-so-high/', 'desc': ""Just five years ago, Nvidia's (NVDA 9.72%) share price was less than $50. \nBut since then, the leading maker of graphics processing units..."", 'title': ""Why Is Nvidia's Stock Price So High?"", 'source': 'The Motley Fool', 'pos_overall': 1, 'relative_publish_date': '4 days ago'}, {'url': 'https://www.barrons.com/articles/nvidia-stock-price-earnings-buy-sell-db2aeebb', 'desc': 'Nvidia announces a big dividend hike and 10-for-1 stock split with its \nearnings report on Wednesday.', 'title': 'Nvidia Stock Gains Ahead of Earnings. Why the Numbers Could Wow.', 'source': ""Barron's"", 'pos_overall': 2, 'relative_publish_date': '3 days ago'}, {'url': 'https://www.investopedia.com/nvidia-earnings-surge-pulls-up-nasdaq-chip-etfs-and-others-in-ai-ecosystem-8652850', 'desc': ""Nvidia shares surged following the chipmaker's better-than-expecting \nearnings report, boosting major indexes and exchange-traded funds..."", 'title': 'Nvidia Earnings Surge Pulls Up Nasdaq, Chip ETFs, and Others in AI Ecosystem', 'source': 'Investopedia', 'pos_overall': 3, 'relative_publish_date': '12 hours ago'}, {'url': 'https://markets.businessinsider.com/news/stocks/stock-market-today-nvidia-q1-earnings-split-chips-ai-blackwell-2024-5', 'desc': ""Stocks jumped Thursday with investors feeling buoyant after Nvidia's big \nfirst-quarter earnings report. The chip maker beat revenue and..."", 'title': ""Stock Market Today: Indexes Pop After Nvidia's Blowout Earnings Report"", 'source': 'markets.businessinsider.com', 'pos_overall': 4, 'relative_publish_date': '13 hours ago'}, {'url': 'https://www.fool.com/investing/2024/05/20/history-says-an-nvidia-stock-split-announcement/', 'desc': 'Nvidia (NVDA 10.50%) has risen to become a nearly $1,000 stock again, which \nis usually a threshold where investors start to expect a stock...', 'title': 'History Says an Nvidia Stock-Split Announcement Might Be Coming on May 22', 'source': 'The Motley Fool', 'pos_overall': 5, 'relative_publish_date': '3 days ago'}, {'url': 'https://finance.yahoo.com/news/stock-market-reclaims-record-highs-160703206.html', 'desc': 'On Thursday, Wall Street opened the session with significant milestones as \nthe S&P 500 and the Nasdaq 100 indices surged to new record highs...', 'title': ""Stock Market Reclaims Record Highs, Nvidia Tops $1,000 As AI-Driven Rally \nResumes: Thursday's Top Movers"", 'source': 'Yahoo Finance', 'pos_overall': 6, 'relative_publish_date': '11 hours ago'}, {'url': 'https://www.thestreet.com/investing/stocks/stock-market-today-stocks-slip-with-nvidia-earnings-on-deck-target-tumbles', 'desc': ""Nvidia, the market's best-performing stock over the past five years, will \nreport first quarter earnings after the close of trading."", 'title': 'Stock Market Today: Stocks mixed with Nvidia earnings on deck; Target \nplunges', 'source': 'TheStreet', 'pos_overall': 7, 'relative_publish_date': '1 day ago'}]",,11,12000
2024-05-24 03:04:36,2024-05-24 03:04:58,12,https://www.google.com/search?q=nvidia+stock&tbm=nws&uule=w+CAIQICINdW5pdGVkIHN0YXRlcw&gl=us&hl=en&start=110,7199606184179936257,200,,https://www.google.com/search?q=nvidia+stock&tbm=nws&uule=w+CAIQICINdW5pdGVkIHN0YXRlcw&gl=us&hl=en&start=110,12,"[{'url': 'https://apnews.com/article/stock-market-china-inflation-rates-e13634fc3292c49b2261fd51bb344e14', 'desc': 'Most U.S. stocks slumped after strong economic reports raised the \npossibility of interest rates staying painfully high.', 'title': 'Stock market today: Wall Street slumps to worst day since April on worries \nabout interest rates', 'source': 'AP News', 'pos_overall': 1, 'relative_publish_date': '6 hours ago'}, {'url': 'https://247wallst.com/investing/2024/05/21/3-reasons-nvidia-is-about-to-announce-a-stock-split/', 'desc': 'Tomorrow, NVIDIA (NASDAQ:NVDA) is set to announce first quarter earnings \nand there is a very real change its share price pops above the...', 'title': '3 Reasons NVIDIA Is About to Announce a Stock Split', 'source': '24/7 Wall St.', 'pos_overall': 2, 'relative_publish_date': '2 days ago'}, {'url': 'https://finance.yahoo.com/news/nvidia-earnings-revenue-expected-to-surge-first-quarter-as-ai-trade-faces-latest-test-194153315.html', 'desc': 'Nvidia will report its fiscal Q1 earnings after the bell on Wednesday in a \ncrucial report for both the AI trade and broader stock market.', 'title': 'Nvidia stock retreats from record high ahead of crucial first quarter \nearnings report', 'source': 'Yahoo Finance', 'pos_overall': 3, 'relative_publish_date': '1 day ago'}, {'url': 'https://www.cnbc.com/2024/05/22/the-key-levels-to-watch-on-nvidias-stock-chart-with-its-big-earnings-report-almost-here.html', 'desc': 'Frank Cappelleri gives a full breakdown of Nvidia results ahead of the big \nearnings.', 'title': ""The key levels to watch on Nvidia's stock chart with its big earnings \nreport almost here"", 'source': 'CNBC', 'pos_overall': 4, 'relative_publish_date': '1 day ago'}, {'url': 'https://www.cnbc.com/2024/05/24/cio-shares-nvidia-alternative-ai-stocks-theres-another-way-to-play-this.html', 'desc': 'Nvidia is showing no signs of slowing down, but there are other ways to \nplay the AI trend, according to a CIO, who recommends ""old economy""...', 'title': ""CIO shares Nvidia alternatives to cash in on the AI theme: 'There's another \nway to play this'"", 'source': 'CNBC', 'pos_overall': 5, 'relative_publish_date': '3 hours ago'}, {'url': 'https://www.investopedia.com/dow-jones-today-05222024-8652227', 'desc': ""U.S. stocks slid from record highs on Wednesday after the minutes of the \nFederal Reserve's May meeting highlighted officials' inflation..."", 'title': 'Dow Jones Today: Stocks Slip as Fed Minutes Spook Investors Ahead of Nvidia \nEarnings', 'source': 'Investopedia', 'pos_overall': 6, 'relative_publish_date': '1 day ago'}, {'url': 'https://www.fool.com/investing/2024/05/19/buy-nvidia-stock-artificial-intelligence-ai/', 'desc': 'The artificial intelligence (AI) rockstar is poised to report earnings on \nWednesday. Will the stock rally higher? Nvidia (NVDA -0.46%) has...', 'title': 'Should You Buy Nvidia Stock Before Wednesday?', 'source': 'The Motley Fool', 'pos_overall': 7, 'relative_publish_date': '4 days ago'}, {'url': 'https://finance.yahoo.com/video/stocks-slide-post-nvidia-q1-204659649.html', 'desc': ""Despite the anticipation that Nvidia's (NVDA) earnings would contribute to \nmarket growth, stocks (^DJI, ^IXIC, ^GSPC) are sliding as the..."", 'title': 'Stocks slide post Nvidia Q1 beat: What investors should do now', 'source': 'Yahoo Finance', 'pos_overall': 8, 'relative_publish_date': '6 hours ago'}, {'url': 'https://finance.yahoo.com/video/nvidia-ceo-explains-why-teslas-110022884.html', 'desc': ""Nvidia's (NVDA) first quarter results beat analyst expectations, with \nrevenue rising 262% to $26.0 billion. The company also announced a..."", 'title': ""Nvidia CEO explains why Tesla's use of AI is 'revolutionary'"", 'source': 'Yahoo Finance', 'pos_overall': 9, 'relative_publish_date': '16 hours ago'}]",,12,12000
